Teks,label,clean_text,normal_text,removedsw_text,stemmed_text,tokenized_text
Ada yg tau ruangan pak daya yg di fpmipa b?,0,ada yg tau ruangan pak daya yg di fpmipa b,ada yang tahu ruangan pak daya yang di fpmipa b,tahu ruangan pak daya yang di fpmipa b,tahu ruang pak daya yang di fpmipa b,"['tahu', 'ruang', 'pak', 'daya', 'yang', 'di', 'fpmipa', 'b']"
"Ada yg tdk bisa jam tertentu? Kemungkinan pagi jam 8, tapi nanti diumumkan.",0,ada yg tdk bisa jam tertentu kemungkinan pagi jam  tapi nanti diumumkan,ada yang tidak bisa jam tertentu kemungkinan pagi jam tapi nanti diumumkan,yang bisa jam tertentu kemungkinan pagi jam nanti diumumkan,yang bisa jam tentu mungkin pagi jam nanti umum,"['yang', 'bisa', 'jam', 'tentu', 'mungkin', 'pagi', 'jam', 'nanti', 'umum']"
Aduh aku ge ini pusing yg mau lamaran siapa yg nyari2 kebutuhan siapa,0,aduh aku ge ini pusing yg mau lamaran siapa yg nyari kebutuhan siapa,aduh aku ge ini pusing yang mau lamaran siapa yang mencari kebutuhan siapa,aduh aku ge pusing mau lamaran siapa mencari kebutuhan siapa,aduh aku ge pusing mau lamar siapa cari butuh siapa,"['aduh', 'aku', 'ge', 'pusing', 'mau', 'lamar', 'siapa', 'cari', 'butuh', 'siapa']"
Aigoo banyak banget chatnyaa aku baru liat hape hehehe,0,aigoo banyak banget chatnyaa aku baru liat hape hehehe,aigoo banyak banget chatnyaa aku baru lihat hape hehehe,aigoo banyak banget chatnyaa aku baru lihat hape hehehe,aigoo banyak banget chatnyaa aku baru lihat hape hehehe,"['aigoo', 'banyak', 'banget', 'chatnyaa', 'aku', 'baru', 'lihat', 'hape', 'hehehe']"
"Airnya asa kurang lancar, besok ku tanya papa yah,",0,airnya asa kurang lancar besok ku tanya papa yah,airnya asa kurang lancar besok ku tanya papa yah,airnya asa kurang lancar besok ku tanya papa yah,air asa kurang lancar besok ku tanya papa yah,"['air', 'asa', 'kurang', 'lancar', 'besok', 'ku', 'tanya', 'papa', 'yah']"
Ajakin ke soekarno hatta aja nama1 . Makan di eatboss soekarno hatta wkwkw,0,ajakin ke soekarno hatta aja nama makan di eatboss soekarno hatta wkwkw,ajakin ke soekarno hatta saja nama makan di eatboss soekarno hatta wkwkw,ajakin soekarno hatta nama makan eatboss soekarno hatta wkwkw,ajakin soekarno hatta nama makan eatboss soekarno hatta wkwkw,"['ajakin', 'soekarno', 'hatta', 'nama', 'makan', 'eatboss', 'soekarno', 'hatta', 'wkwkw']"
"Aku ada spagetti, tp usah kaldaluarsa belum yah",0,aku ada spagetti tp usah kaldaluarsa belum yah,aku ada spagetti tapi perlu kaldaluarsa belum yah,aku spagetti perlu kaldaluarsa yah,aku spagetti perlu kaldaluarsa yah,"['aku', 'spagetti', 'perlu', 'kaldaluarsa', 'yah']"
Aku bawa daging yg dah direbus gapapa? Yg mentah tinggal tulang2an wkwk,0,aku bawa daging yg dah direbus gapapa yg mentah tinggal tulangan wkwk,aku bawa daging yang sudah direbus tidak apa-apa yang mentah tinggal tulangan tertawa,aku bawa daging sudah direbus apa-apa mentah tinggal tulangan tertawa,aku bawa daging sudah rebus apa mentah tinggal tulang tertawa,"['aku', 'bawa', 'daging', 'sudah', 'rebus', 'apa', 'mentah', 'tinggal', 'tulang', 'tertawa']"
Aku besok dtg agak telat jam 8 boleh ngga? Kan jam 10 ya mulainya?,0,aku besok dtg agak telat jam  boleh ngga kan jam  ya mulainya,aku besok datang agak terlambat jam boleh tidak kan jam iya mulainya,aku besok datang terlambat jam tidak kan jam iya mulainya,aku besok datang lambat jam tidak kan jam iya mulai,"['aku', 'besok', 'datang', 'lambat', 'jam', 'tidak', 'kan', 'jam', 'iya', 'mulai']"
"aku delete aja ya, ntar nama1 pull dulu atau sync dulu, ntar masukin yang nama1 , baru push.",0,aku delete aja ya ntar nama pull dulu atau sync dulu ntar masukin yang nama baru push,aku delete saja iya sebentar nama pull dulu atau sync dulu sebentar masukkan yang nama baru push,aku delete iya sebentar nama pull dulu sync dulu sebentar masukkan nama baru push,aku delete iya sebentar nama pull dulu sync dulu sebentar masuk nama baru push,"['aku', 'delete', 'iya', 'sebentar', 'nama', 'pull', 'dulu', 'sync', 'dulu', 'sebentar', 'masuk', 'nama', 'baru', 'push']"
Aku depan pasca skrng,0,aku depan pasca skrng,aku depan pasca skrng,aku depan pasca skrng,aku depan pasca skrng,"['aku', 'depan', 'pasca', 'skrng']"
Aku di pt. DI,0,aku di pt di,aku di pt di,aku pt,aku pt,"['aku', 'pt']"
Aku dy wkwk makanya kurang direstui jg krna kejauhan,0,aku dy wkwk makanya kurang direstui jg krna kejauhan,aku dia tertawa makanya kurang direstui juga krna kejauhan,aku tertawa makanya kurang direstui krna kejauhan,aku tertawa makanya kurang restu krna jauh,"['aku', 'tertawa', 'makanya', 'kurang', 'restu', 'krna', 'jauh']"
"Aku ga enak euy bilang ke adiknya, adiknya pengen ke pvj nama1  :(",0,aku ga enak euy bilang ke adiknya adiknya pengen ke pvj nama,aku tidak enak euy bilang ke adiknya adiknya ingin ke pvj nama,aku enak euy bilang adiknya adiknya ke pvj nama,aku enak euy bilang adik adik ke pvj nama,"['aku', 'enak', 'euy', 'bilang', 'adik', 'adik', 'ke', 'pvj', 'nama']"
Aku ga ke upi sepertinya,0,aku ga ke upi sepertinya,aku tidak ke upi sepertinya,aku ke upi sepertinya,aku ke upi seperti,"['aku', 'ke', 'upi', 'seperti']"
"Aku ingin pagi, tp masa berdua nama1 doang pake grab :( nunggu nama1 siang :(",0,aku ingin pagi tp masa berdua nama doang pake grab nunggu nama siang,aku ingin pagi tapi masa berdua nama saja pakai grab menunggu nama siang,aku pagi masa berdua nama pakai grab menunggu nama siang,aku pagi masa dua nama pakai grab tunggu nama siang,"['aku', 'pagi', 'masa', 'dua', 'nama', 'pakai', 'grab', 'tunggu', 'nama', 'siang']"
Aku jg blm berangkt wkwk,0,aku jg blm berangkt wkwk,aku juga belum berangkt tertawa,aku belum berangkt tertawa,aku belum berangkt tertawa,"['aku', 'belum', 'berangkt', 'tertawa']"
Aku jg di rumah lg ga ada apa2 gara2 kulkas rusak :( biasanya suka nyetok sayur,0,aku jg di rumah lg ga ada apa gara kulkas rusak biasanya suka nyetok sayur,aku juga di rumah lagi tidak ada apa gara kulkas rusak biasanya suka nyetok sayur,aku di rumah tidak apa gara kulkas rusak biasanya suka nyetok sayur,aku di rumah tidak apa gara kulkas rusak biasa suka nyetok sayur,"['aku', 'di', 'rumah', 'tidak', 'apa', 'gara', 'kulkas', 'rusak', 'biasa', 'suka', 'nyetok', 'sayur']"
"Aku jg waktu itu foto tgl 17 juli, katanya selesai 29 agustus :(",0,aku jg waktu itu foto tgl  juli katanya selesai  agustus,aku juga waktu itu foto tanggal juli katanya selesai agustus,aku waktu foto tanggal juli katanya selesai agustus,aku waktu foto tanggal juli kata selesai agustus,"['aku', 'waktu', 'foto', 'tanggal', 'juli', 'kata', 'selesai', 'agustus']"
aku kira bukan besoook :'(,0,aku kira bukan besoook,aku kira bukan besoook,aku kira bukan besoook,aku kira bukan besoook,"['aku', 'kira', 'bukan', 'besoook']"
"Aku kumpul pon dulu dy, kalo haris kerjanya dari sore mo pacaran dulu dy",0,aku kumpul pon dulu dy kalo haris kerjanya dari sore mo pacaran dulu dy,aku kumpul pon dulu dia kalau haris kerjanya dari sore mau pacaran dulu dia,aku kumpul pon dulu kalau haris kerjanya sore mau pacaran dulu,aku kumpul pon dulu kalau haris kerja sore mau pacar dulu,"['aku', 'kumpul', 'pon', 'dulu', 'kalau', 'haris', 'kerja', 'sore', 'mau', 'pacar', 'dulu']"
Aku mah plg kerumah ketemu ayah mama cukup kok :'),0,aku mah plg kerumah ketemu ayah mama cukup kok,aku mah paling kerumah ketemu ayah mama cukup kok,aku mah paling kerumah ketemu ayah mama cukup kok,aku mah paling rumah ketemu ayah mama cukup kok,"['aku', 'mah', 'paling', 'rumah', 'ketemu', 'ayah', 'mama', 'cukup', 'kok']"
"Aku mah sering ditinggal jualan, jd mau marah juga ntar alesannya ""duit kan buat km juga"", diem lgsg haha",0,aku mah sering ditinggal jualan jd mau marah juga ntar alesannya duit kan buat km juga diem lgsg haha,aku mah sering ditinggal jualan jadi mau marah juga sebentar alesannya uang kan buat kamu juga diem langsung tertawa,aku mah sering ditinggal jualan jadi mau marah sebentar alesannya uang kan buat kamu diem langsung tertawa,aku mah sering tinggal jual jadi mau marah sebentar alesannya uang kan buat kamu diem langsung tertawa,"['aku', 'mah', 'sering', 'tinggal', 'jual', 'jadi', 'mau', 'marah', 'sebentar', 'alesannya', 'uang', 'kan', 'buat', 'kamu', 'diem', 'langsung', 'tertawa']"
Aku mau bawa balon sm coklat min. Mau nitip?,0,aku mau bawa balon sm coklat min mau nitip,aku mau bawa balon sm coklat min mau nitip,aku mau bawa balon sm coklat min mau nitip,aku mau bawa balon sm coklat min mau nitip,"['aku', 'mau', 'bawa', 'balon', 'sm', 'coklat', 'min', 'mau', 'nitip']"
Aku mau nyari data yang dibutuhin dari tabel mana aja.,0,aku mau nyari data yang dibutuhin dari tabel mana aja,aku mau mencari data yang dibutuhin dari tabel mana saja,aku mau mencari data dibutuhin tabel mana,aku mau cari data dibutuhin tabel mana,"['aku', 'mau', 'cari', 'data', 'dibutuhin', 'tabel', 'mana']"
"Aku merasa geleh sendiiri ini lipstik aku merah sekali wkkw, mana dapet dikasih ini jg",0,aku merasa geleh sendiiri ini lipstik aku merah sekali wkkw mana dapet dikasih ini jg,aku merasa geleh sendiiri ini lipstik aku merah sekali wkkw mana dapat dikasih ini juga,aku merasa geleh sendiiri lipstik aku merah sekali wkkw mana dikasih juga,aku rasa geleh sendiiri lipstik aku merah sekali wkkw mana kasih juga,"['aku', 'rasa', 'geleh', 'sendiiri', 'lipstik', 'aku', 'merah', 'sekali', 'wkkw', 'mana', 'kasih', 'juga']"
"aku push yang updatenya, itu udah di template sama adminLTE.",0,aku push yang updatenya itu udah di template sama adminlte,aku push yang updatenya itu sudah di template sama adminlte,aku push updatenya sudah template sama adminlte,aku push updatenya sudah template sama adminlte,"['aku', 'push', 'updatenya', 'sudah', 'template', 'sama', 'adminlte']"
Aku senin udah ke tempat kerja. Minggu2 depan aku gaktau bisa/ngga :(,0,aku senin udah ke tempat kerja minggu depan aku gaktau bisa ngga,aku senin sudah ke tempat kerja minggu depan aku gaktau bisa tidak,aku senin ke tempat kerja minggu depan aku gaktau tidak,aku senin ke tempat kerja minggu depan aku gaktau tidak,"['aku', 'senin', 'ke', 'tempat', 'kerja', 'minggu', 'depan', 'aku', 'gaktau', 'tidak']"
Aku teh cuma bawa celana jeans yg tua tp jilbabnya yg muda -_-,0,aku teh cuma bawa celana jeans yg tua tp jilbabnya yg muda _,aku kakak perempuan cuma bawa celana jeans yang tua tapi jilbabnya yang muda _,aku kakak perempuan cuma bawa celana jeans tua jilbabnya muda _,aku kakak perempuan cuma bawa celana jeans tua jilbab muda,"['aku', 'kakak', 'perempuan', 'cuma', 'bawa', 'celana', 'jeans', 'tua', 'jilbab', 'muda']"
"Alhamdulillah, makasih yaaa udah meluangkan waktu 😘",0,alhamdulillah makasih yaaa udah meluangkan waktu,alhamdulillah terima kasih yaaa sudah meluangkan waktu,alhamdulillah terima kasih yaaa meluangkan waktu,alhamdulillah terima kasih yaaa luang waktu,"['alhamdulillah', 'terima', 'kasih', 'yaaa', 'luang', 'waktu']"
"Alhamdulillah, puji syukur atas nikmat Allah swt. yang telah memberikan nikmat hidup sampai detik ini sehingga saya masih bisa untuk mengevaluasi diri. Selama itu tentu saya menyadari banyak melakukan kekhilafan dan kesalahan.",0,alhamdulillah puji syukur atas nikmat allah swt yang telah memberikan nikmat hidup sampai detik ini sehingga saya masih bisa untuk mengevaluasi diri selama itu tentu saya menyadari banyak melakukan kekhilafan dan kesalahan,alhamdulillah puji syukur atas nikmat allah swt yang telah memberikan nikmat hidup sampai detik ini sehingga saya masih bisa untuk mengevaluasi diri selama itu tentu saya menyadari banyak melakukan kekhilafan dan kesalahan,alhamdulillah puji syukur atas nikmat allah swt telah memberikan nikmat hidup detik sehingga masih untuk mengevaluasi diri selama tentu menyadari banyak melakukan kekhilafan kesalahan,alhamdulillah puji syukur atas nikmat allah swt telah beri nikmat hidup detik sehingga masih untuk evaluasi diri lama tentu sadar banyak laku khilaf salah,"['alhamdulillah', 'puji', 'syukur', 'atas', 'nikmat', 'allah', 'swt', 'telah', 'beri', 'nikmat', 'hidup', 'detik', 'sehingga', 'masih', 'untuk', 'evaluasi', 'diri', 'lama', 'tentu', 'sadar', 'banyak', 'laku', 'khilaf', 'salah']"
"Alhamdullilah sudah beres semua :)  Bagi yang mau keluar dari group dipersilahkan, tapi silahkan juga kalau ada yg mau memanfaatkan group ini untuk diskusi dengan topik terkait untuk skripsi/gemastik/kerjaan.",0,alhamdullilah sudah beres semua bagi yang mau keluar dari group dipersilahkan tapi silahkan juga kalau ada yg mau memanfaatkan group ini untuk diskusi dengan topik terkait untuk skripsi gemastik kerjaan,alhamdullilah sudah beres semua bagi yang mau keluar dari group dipersilahkan tapi silahkan juga kalau ada yang mau memanfaatkan group ini untuk diskusi dengan topik terkait untuk skripsi gemastik kerjaan,alhamdullilah beres semua yang mau keluar group dipersilahkan silahkan kalau yang mau memanfaatkan group diskusi topik terkait untuk skripsi gemastik kerjaan,alhamdullilah beres semua yang mau keluar group silah silah kalau yang mau manfaat group diskusi topik kait untuk skripsi gemastik kerja,"['alhamdullilah', 'beres', 'semua', 'yang', 'mau', 'keluar', 'group', 'silah', 'silah', 'kalau', 'yang', 'mau', 'manfaat', 'group', 'diskusi', 'topik', 'kait', 'untuk', 'skripsi', 'gemastik', 'kerja']"
AndiPublisher.com#PO0216020925#96000#02-02-2016#BNI#Bank Mandiri,0,andipublisher com po     bni bank mandiri,andipublisher com po bni bank mandiri,andipublisher com po bni bank mandiri,andipublisher com po bni bank mandiri,"['andipublisher', 'com', 'po', 'bni', 'bank', 'mandiri']"
Asal pagi pagi ya.. Bjam 10an saya sudah ke jakarta..,0,asal pagi pagi ya bjam an saya sudah ke jakarta,asal pagi pagi iya bjam an saya sudah ke jakarta,asal pagi pagi iya bjam an sudah jakarta,asal pagi pagi iya bjam an sudah jakarta,"['asal', 'pagi', 'pagi', 'iya', 'bjam', 'an', 'sudah', 'jakarta']"
"nama1  jg text dy, text essay jawaban gt Jd misal nih ada murid sama guru, si guru ngasih ujian, nanti hasil jawaban ujian murid dibandingin sama jawaban dari guru (jawaban yg bener) trs outputnya berupa skor hasil ujian itu",0,nama jg text dy text essay jawaban gt jd misal nih ada murid sama guru si guru ngasih ujian nanti hasil jawaban ujian murid dibandingin sama jawaban dari guru jawaban yg bener trs outputnya berupa skor hasil ujian itu,nama juga text dia text essay jawaban begitu jadi misal ini ada murid sama guru si guru memberikan ujian nanti hasil jawaban ujian murid dibandingin sama jawaban dari guru jawaban yang benar terus outputnya berupa skor hasil ujian itu,nama text text essay jawaban jadi misal ada murid sama guru si guru memberikan ujian hasil jawaban ujian murid dibandingin sama jawaban guru jawaban benar terus outputnya berupa skor hasil ujian,nama text text essay jawab jadi misal ada murid sama guru si guru beri uji hasil jawab uji murid dibandingin sama jawab guru jawab benar terus outputnya upa skor hasil uji,"['nama', 'text', 'text', 'essay', 'jawab', 'jadi', 'misal', 'ada', 'murid', 'sama', 'guru', 'si', 'guru', 'beri', 'uji', 'hasil', 'jawab', 'uji', 'murid', 'dibandingin', 'sama', 'jawab', 'guru', 'jawab', 'benar', 'terus', 'outputnya', 'upa', 'skor', 'hasil', 'uji']"
nama1 itu msh pake db aku yg lama itu msh anomali bisa nyesuain ga,0,nama itu msh pake db aku yg lama itu msh anomali bisa nyesuain ga,nama itu masih pakai db aku yang lama itu masih anomali bisa nyesuain tidak,nama masih pakai db aku lama masih anomali nyesuain,nama masih pakai db aku lama masih anomali nyesuain,"['nama', 'masih', 'pakai', 'db', 'aku', 'lama', 'masih', 'anomali', 'nyesuain']"
nama1 seharusnya cuman nambah table daftar_ulang_ird + kalau ada masternya. Yg lain kita samain aja ya pake yg aku data_pasien (2).sql,0,nama seharusnya cuman nambah table daftar_ulang_ird kalau ada masternya yg lain kita samain aja ya pake yg aku data_pasien  sql,nama seharusnya Cuma nambah table daftar_ulang_ird kalau ada masternya yang lain kita samain saja iya pakai yang aku data_pasien sql,nama Cuma nambah table daftar_ulang_ird kalau masternya lain samain iya pakai aku data_pasien sql,nama cuma nambah table daftar ulang ird kalau master lain samain iya pakai aku data pasien sql,"['nama', 'cuma', 'nambah', 'table', 'daftar', 'ulang', 'ird', 'kalau', 'master', 'lain', 'samain', 'iya', 'pakai', 'aku', 'data', 'pasien', 'sql']"
"Assalamualaikum akang teteh, jangan lupa ya hari ini ada carrier day jam 10:30, exhibition fpmipa b :) (love) Hayuu teh ditungguuu",0,assalamualaikum akang teteh jangan lupa ya hari ini ada carrier day jam   exhibition fpmipa b love hayuu teh ditungguuu,assalamualaikum akang teteh jangan lupa iya hari ini ada carrier day jam exhibition fpmipa b love hayuu kakak perempuan ditungguuu,assalamualaikum akang teteh jangan lupa iya hari ada carrier day jam exhibition fpmipa b love hayuu kakak perempuan ditungguuu,assalamualaikum akang teteh jangan lupa iya hari ada carrier day jam exhibition fpmipa b love hayuu kakak perempuan ditungguuu,"['assalamualaikum', 'akang', 'teteh', 'jangan', 'lupa', 'iya', 'hari', 'ada', 'carrier', 'day', 'jam', 'exhibition', 'fpmipa', 'b', 'love', 'hayuu', 'kakak', 'perempuan', 'ditungguuu']"
"Assalamualaikum Bu. Saya nama1 mhsi ilkom 2012 baru dpt pembimbing skripsi. Mohon maaf bu, kalau minggu ini ada di kampus hari ap aj Bu? Terima kasih.",0,assalamualaikum bu saya nama mhsi ilkom  baru dpt pembimbing skripsi mohon maaf bu kalau minggu ini ada di kampus hari ap aj bu terima kasih,assalamualaikum bu saya nama mhsi ilkom baru dapat pembimbing skripsi mohon maaf bu kalau minggu ini ada di kampus hari apa saja bu terima kasih,assalamualaikum bu nama mhsi ilkom baru pembimbing skripsi mohon maaf bu kalau minggu ada kampus hari apa bu terima kasih,assalamualaikum bu nama mhsi ilkom baru bimbing skripsi mohon maaf bu kalau minggu ada kampus hari apa bu terima kasih,"['assalamualaikum', 'bu', 'nama', 'mhsi', 'ilkom', 'baru', 'bimbing', 'skripsi', 'mohon', 'maaf', 'bu', 'kalau', 'minggu', 'ada', 'kampus', 'hari', 'apa', 'bu', 'terima', 'kasih']"
"Assalamualaikum pak, mau nanya seputar mobcom sp, apakah harus ikut perkuliahan dari sekarang apa bisa ikut pas sp nanti aja pak? Trims ",0,assalamualaikum pak mau nanya seputar mobcom sp apakah harus ikut perkuliahan dari sekarang apa bisa ikut pas sp nanti aja pak trims,assalamualaikum pak mau bertanya seputar mobcom sp apakah harus ikut perkuliahan dari sekarang apa bisa ikut pas sp nanti saja pak terima kasih,assalamualaikum pak mau bertanya seputar mobcom sp harus ikut perkuliahan sekarang apa ikut pas sp saja pak terima kasih,assalamualaikum pak mau tanya putar mobcom sp harus ikut kuliah sekarang apa ikut pas sp saja pak terima kasih,"['assalamualaikum', 'pak', 'mau', 'tanya', 'putar', 'mobcom', 'sp', 'harus', 'ikut', 'kuliah', 'sekarang', 'apa', 'ikut', 'pas', 'sp', 'saja', 'pak', 'terima', 'kasih']"
"assalamualaikum pak, mohon maaf saya mau tanya pak, apakah remedial dwm harus hadir di tempat pak? apa bisa online? mohon maaf sebelumnya",0,assalamualaikum pak mohon maaf saya mau tanya pak apakah remedial dwm harus hadir di tempat pak apa bisa online mohon maaf sebelumnya,assalamualaikum pak mohon maaf saya mau tanya pak apakah remedial dwm harus hadir di tempat pak apa bisa online mohon maaf sebelumnya,assalamualaikum pak mohon maaf mau tanya pak remedial dwm hadir tempat pak apa online mohon maaf sebelumnya,assalamualaikum pak mohon maaf mau tanya pak remedial dwm hadir tempat pak apa online mohon maaf belum,"['assalamualaikum', 'pak', 'mohon', 'maaf', 'mau', 'tanya', 'pak', 'remedial', 'dwm', 'hadir', 'tempat', 'pak', 'apa', 'online', 'mohon', 'maaf', 'belum']"
Assalamualaikum Pak. Ini dg nama1 ilkom 2012. Maaf Pak td saya ninggalin proposal di meja Bapak di atas printer. Terima kasih Pak.,0,assalamualaikum pak ini dg nama ilkom  maaf pak td saya ninggalin proposal di meja bapak di atas printer terima kasih pak,assalamualaikum pak ini dengan nama ilkom maaf pak tadi saya ninggalin proposal di meja bapak di atas printer terima kasih pak,assalamualaikum pak dengan nama ilkom maaf pak tadi ninggalin proposal meja bapak atas printer terima kasih pak,assalamualaikum pak dengan nama ilkom maaf pak tadi ninggalin proposal meja bapak atas printer terima kasih pak,"['assalamualaikum', 'pak', 'dengan', 'nama', 'ilkom', 'maaf', 'pak', 'tadi', 'ninggalin', 'proposal', 'meja', 'bapak', 'atas', 'printer', 'terima', 'kasih', 'pak']"
Assalamu'alaikum wr wb. Berikut daftar penguji PLA tahap 4,0,assalamu alaikum wr wb berikut daftar penguji pla tahap ,assalamu alaikum wr wb berikut daftar penguji pla tahap,assalamu alaikum wr wb berikut daftar penguji pla tahap,assalamu alaikum wr wb ikut daftar uji pla tahap,"['assalamu', 'alaikum', 'wr', 'wb', 'ikut', 'daftar', 'uji', 'pla', 'tahap']"
"Assalamu'alaikum, nama1 mau minta bantuan.",0,assalamu alaikum nama mau minta bantuan,assalamu alaikum nama mau minta bantuan,assalamu alaikum nama mau minta bantuan,assalamu alaikum nama mau minta bantu,"['assalamu', 'alaikum', 'nama', 'mau', 'minta', 'bantu']"
Assalamualaikum. Ada yg tau kalo file buat penilaian ada di mana? Apa ada di fb?,0,assalamualaikum ada yg tau kalo file buat penilaian ada di mana apa ada di fb,assalamualaikum ada yang tahu kalau file buat penilaian ada di mana apa ada di facebook,assalamualaikum yang tahu kalau file buat penilaian di mana apa di facebook,assalamualaikum yang tahu kalau file buat nilai di mana apa di facebook,"['assalamualaikum', 'yang', 'tahu', 'kalau', 'file', 'buat', 'nilai', 'di', 'mana', 'apa', 'di', 'facebook']"
"Atau gaperlu ke kampus nama1 , tolong kirimin kuncinya aja make jne cenah ip",0,atau gaperlu ke kampus nama tolong kirimin kuncinya aja make jne cenah ip,atau gaperlu ke kampus nama tolong kirimin kuncinya saja make jne cenah ip,gaperlu kampus nama kirimin kuncinya make jne cenah ip,gaperlu kampus nama kirimin kunci make jne cenah ip,"['gaperlu', 'kampus', 'nama', 'kirimin', 'kunci', 'make', 'jne', 'cenah', 'ip']"
"Atuhlah, aku telah meninggalkan yg nyaah, jgn gitulah gais, bisi teringat masa lalu 😢",0,atuhlah aku telah meninggalkan yg nyaah jgn gitulah gais bisi teringat masa lalu,atuhlah aku telah meninggalkan yang nyaah jangan gitulah gais kalau-kalau teringat masa lalu,atuhlah aku meninggalkan nyaah jangan gitulah gais kalau-kalau teringat masa lalu,atuhlah aku tinggal nyaah jangan gitulah gais kalau ingat masa lalu,"['atuhlah', 'aku', 'tinggal', 'nyaah', 'jangan', 'gitulah', 'gais', 'kalau', 'ingat', 'masa', 'lalu']"
atulah aku teh udh ngidam sate maranggi dr bulan puasa 󾌹 naha ka subang teu ngajakan ih,0,atulah aku teh udh ngidam sate maranggi dr bulan puasa naha ka subang teu ngajakan ih,atulah aku kakak perempuan sudah ngidam sate maranggi dari bulan puasa naha kakak subang teu ngajakan ih,atulah aku kakak perempuan ngidam sate maranggi bulan puasa naha kakak subang teu ngajakan ih,atulah aku kakak perempuan ngidam sate maranggi bulan puasa naha kakak subang teu ngajakan ih,"['atulah', 'aku', 'kakak', 'perempuan', 'ngidam', 'sate', 'maranggi', 'bulan', 'puasa', 'naha', 'kakak', 'subang', 'teu', 'ngajakan', 'ih']"
"Ayam aja Pak, terus satu paket itu sama isinya ap aja?",0,ayam aja pak terus satu paket itu sama isinya ap aja,ayam saja pak terus satu paket itu sama isinya apa saja,ayam pak terus satu paket sama isinya apa,ayam pak terus satu paket sama isi apa,"['ayam', 'pak', 'terus', 'satu', 'paket', 'sama', 'isi', 'apa']"
Ayam kita menunya banyak bu...ada ayam bakar.kremes. cabe ijo. Lada hitam. Asam manis. Rica rica. Baberque. Untuk isinya nasi.ayam.lalapan.sambal. tempe tahu . air mineral gelas. Bu...maaf bu kita ada paket yang 16rb s/d 19rb. Kalau boleh tau anggaran ibu berapa ya,0,ayam kita menunya banyak bu ada ayam bakar kremes cabe ijo lada hitam asam manis rica rica baberque untuk isinya nasi ayam lalapan sambal tempe tahu air mineral gelas bu maaf bu kita ada paket yang rb s d rb kalau boleh tau anggaran ibu berapa ya,ayam kita menunya banyak bu ada ayam bakar kremes cabe ijo lada hitam asam manis rica rica baberque untuk isinya nasi ayam lalapan sambal tempe tahu air mineral gelas bu maaf bu kita ada paket yang rb s di rb kalau boleh tahu anggaran ibu berapa iya,ayam menunya banyak bu ayam bakar kremes cabe ijo lada hitam asam manis rica rica baberque isinya nasi ayam lalapan sambal tempe tahu air mineral gelas bu maaf bu ada paket rb s rb kalau tahu anggaran ibu berapa iya,ayam menu banyak bu ayam bakar kremes cabe ijo lada hitam asam manis rica rica baberque isi nasi ayam lalap sambal tempe tahu air mineral gelas bu maaf bu ada paket rb s rb kalau tahu anggar ibu berapa iya,"['ayam', 'menu', 'banyak', 'bu', 'ayam', 'bakar', 'kremes', 'cabe', 'ijo', 'lada', 'hitam', 'asam', 'manis', 'rica', 'rica', 'baberque', 'isi', 'nasi', 'ayam', 'lalap', 'sambal', 'tempe', 'tahu', 'air', 'mineral', 'gelas', 'bu', 'maaf', 'bu', 'ada', 'paket', 'rb', 's', 'rb', 'kalau', 'tahu', 'anggar', 'ibu', 'berapa', 'iya']"
"Ayo nama1 semangat skripsian yaaah biar cpt lulus, kerja, dan cpt nikah wkwkwk",0,ayo nama semangat skripsian yaaah biar cpt lulus kerja dan cpt nikah wkwkwk,ayo nama semangat skripsian yaaah biar cpt lulus kerja dan cpt nikah wkwkwk,ayo nama semangat skripsian yaaah biar cpt lulus kerja cpt nikah wkwkwk,ayo nama semangat skripsi yaaah biar cpt lulus kerja cpt nikah wkwkwk,"['ayo', 'nama', 'semangat', 'skripsi', 'yaaah', 'biar', 'cpt', 'lulus', 'kerja', 'cpt', 'nikah', 'wkwkwk']"
"bagi yang sudah diuji segera diserahkan dgn dijilid, bagi yg sdg nunggu diuji sabar tuk sesuaikan waktupenguji..",0,bagi yang sudah diuji segera diserahkan dgn dijilid bagi yg sdg nunggu diuji sabar tuk sesuaikan waktupenguji,bagi yang sudah diuji segera diserahkan dengan dijilid bagi yang sedang menunggu diuji sabar tuk sesuaikan waktupenguji,yang diuji segera diserahkan dijilid yang sedang menunggu diuji sabar tuk sesuaikan waktupenguji,yang uji segera serah jilid yang sedang tunggu uji sabar tuk sesuai waktupenguji,"['yang', 'uji', 'segera', 'serah', 'jilid', 'yang', 'sedang', 'tunggu', 'uji', 'sabar', 'tuk', 'sesuai', 'waktupenguji']"
