Teks,label,clean_text,normal_text,removedsw_text,stemmed_text,tokenized_text
"ini nomor baru papa, tolong kirimin pulsa 50.000 ke nomor baru papa 085687329010. Papa lagi di kantor polisi, ada masalah. Jangan telepon Papa.",1,ini nomor baru papa tolong kirimin pulsa   ke nomor baru papa  papa lagi di kantor polisi ada masalah jangan telepon papa,ini nomor baru papa tolong kirimin pulsa ke nomor baru papa papa lagi di kantor polisi ada masalah jangan telepon papa,nomor baru papa kirimin pulsa nomor baru papa papa di kantor polisi masalah jangan telepon papa,nomor baru papa kirimin pulsa nomor baru papa papa di kantor polisi masalah jangan telepon papa,"['nomor', 'baru', 'papa', 'kirimin', 'pulsa', 'nomor', 'baru', 'papa', 'papa', 'di', 'kantor', 'polisi', 'masalah', 'jangan', 'telepon', 'papa']"
Ini nomor rekeningnya: 5829-01-012786-534. BRI a/n Andika Septiana.,1,ini nomor rekeningnya     bri a n andika septiana,ini nomor rekeningnya bri a dan andika septiana,nomor rekeningnya bri a andika septiana,nomor rekening bri a andika septiana,"['nomor', 'rekening', 'bri', 'a', 'andika', 'septiana']"
ini rekeningnya bank bri.no/rek.018801.006474.53.2.a/n:IR MAYANI,1,ini rekeningnya bank bri no rek     a n ir mayani,ini rekeningnya bank bri nomor rek a dan ir mayani,rekeningnya bank bri nomor rek a ir mayani,rekening bank bri nomor rek a ir mayani,"['rekening', 'bank', 'bri', 'nomor', 'rek', 'a', 'ir', 'mayani']"
Ini Rekeningnya BANK MANDIRI. NO.Rek:150-00-1002402-2.A/n: MURTIANI,1,ini rekeningnya bank mandiri no rek     a n murtiani,ini rekeningnya bank mandiri nomor rek a dan murtiani,rekeningnya bank mandiri nomor rek a murtiani,rekening bank mandiri nomor rek a murtiani,"['rekening', 'bank', 'mandiri', 'nomor', 'rek', 'a', 'murtiani']"
Ini Rekeningnya BRI. Rek: 0881-1010-3433-4506 A/n.RASTO MURDOYO.,1,ini rekeningnya bri rek     a n rasto murdoyo,ini rekeningnya bri rek a dan rasto murdoyo,rekeningnya bri rek a rasto murdoyo,rekening bri rek a rasto murdoyo,"['rekening', 'bri', 'rek', 'a', 'rasto', 'murdoyo']"
Ini rekeningnya mandiri : 900-00-1037951-0 a.n reza prasetya,1,ini rekeningnya mandiri     a n reza prasetya,ini rekeningnya mandiri a dan reza prasetya,rekeningnya mandiri a reza prasetya,rekening mandiri a reza prasetya,"['rekening', 'mandiri', 'a', 'reza', 'prasetya']"
Ini Rekeningnya. bank MANDIRI. a/n: ALI SYAMSUDIN. rek: 136-001-198-6939,1,ini rekeningnya bank mandiri a n ali syamsudin rek    ,ini rekeningnya bank mandiri a dan ali syamsudin rek,rekeningnya bank mandiri a ali syamsudin rek,rekening bank mandiri a ali syamsudin rek,"['rekening', 'bank', 'mandiri', 'a', 'ali', 'syamsudin', 'rek']"
"Ini, Rekeningnya. Bank BNI No.rek.0277285682 A/n.WAHYUDI ALAMSYAH sms klo sudah dikirim",1,ini rekeningnya bank bni no rek  a n wahyudi alamsyah sms klo sudah dikirim,ini rekeningnya bank bni nomor rek a dan wahyudi alamsyah sms kalau sudah dikirim,rekeningnya bank bni nomor rek a wahyudi alamsyah sms kalau dikirim,rekening bank bni nomor rek a wahyudi alamsyah sms kalau kirim,"['rekening', 'bank', 'bni', 'nomor', 'rek', 'a', 'wahyudi', 'alamsyah', 'sms', 'kalau', 'kirim']"
"ISI PULSA lebih untung di MYVPLUS! selain dpt PULSA kamu bisa lsg dpt voucher diskon, dpt hadiah dan juga dpt point. Yuk klik : http://bit.ly/Myvplus",1,isi pulsa lebih untung di myvplus selain dpt pulsa kamu bisa lsg dpt voucher diskon dpt hadiah dan juga dpt point yuk klik http bit ly myvplus,isi pulsa lebih untung di myvplus selain dapat pulsa kamu bisa lsg dapat voucher diskon dapat hadiah dan juga dapat point ayo klik http bit ly myvplus,isi pulsa lebih untung myvplus pulsa kamu lsg voucher diskon hadiah juga dapat point ayo klik http bit ly myvplus,isi pulsa lebih untung myvplus pulsa kamu lsg voucher diskon hadiah juga dapat point ayo klik http bit ly myvplus,"['isi', 'pulsa', 'lebih', 'untung', 'myvplus', 'pulsa', 'kamu', 'lsg', 'voucher', 'diskon', 'hadiah', 'juga', 'dapat', 'point', 'ayo', 'klik', 'http', 'bit', 'ly', 'myvplus']"
Isi ulang Pulsa Rp.5000 regular oleh HD COM 4 SUKSES pada 09/02 12:34.Ref:763179369.GRATIS PULSA sd 250rb hg 7Hr 7Mlm.Ktk:GRATIS krm ke 123,1,isi ulang pulsa rp  regular oleh hd com  sukses pada     ref  gratis pulsa sd rb hg hr mlm ktk gratis krm ke ,isi ulang pulsa rp regular oleh hd com sukses pada referensi gratis pulsa sd rb hg hari mlm ktk gratis kirim ke,isi ulang pulsa rp regular hd com sukses referensi gratis pulsa sd rb hg hari mlm ktk gratis kirim,isi ulang pulsa rp regular hd com sukses referensi gratis pulsa sd rb hg hari mlm ktk gratis kirim,"['isi', 'ulang', 'pulsa', 'rp', 'regular', 'hd', 'com', 'sukses', 'referensi', 'gratis', 'pulsa', 'sd', 'rb', 'hg', 'hari', 'mlm', 'ktk', 'gratis', 'kirim']"
Isi ulang Pulsa Rp.5000 Regular oleh PUTERA SUKSES pada 11/02 19:57.Ref:78330280.GRATIS PULSA sd 250rb hg 7Hr 7Mlm.Ktk:GRATIS krm ke 123,1,isi ulang pulsa rp  regular oleh putera sukses pada     ref  gratis pulsa sd rb hg hr mlm ktk gratis krm ke ,isi ulang pulsa rp regular oleh putera sukses pada referensi gratis pulsa sd rb hg hari mlm ktk gratis kirim ke,isi ulang pulsa rp regular putera sukses referensi gratis pulsa sd rb hg hari mlm ktk gratis kirim,isi ulang pulsa rp regular putera sukses referensi gratis pulsa sd rb hg hari mlm ktk gratis kirim,"['isi', 'ulang', 'pulsa', 'rp', 'regular', 'putera', 'sukses', 'referensi', 'gratis', 'pulsa', 'sd', 'rb', 'hg', 'hari', 'mlm', 'ktk', 'gratis', 'kirim']"
Jika anda butuh ANGKA jitu GAIB 2D_3D_4D_SGP Yang dijamin 99% tembus. Silahkan SMS 085337807887 MASTERTOGEL,1,jika anda butuh angka jitu gaib d_d_d_sgp yang dijamin  tembus silahkan sms  mastertogel,jika anda butuh angka jitu gaib d_d_d_sgp yang dijamin tembus silahkan sms mastertogel,anda butuh angka jitu gaib d_d_d_sgp dijamin tembus silahkan sms mastertogel,anda butuh angka jitu gaib d d d sgp jamin tembus silah sms mastertogel,"['anda', 'butuh', 'angka', 'jitu', 'gaib', 'd', 'd', 'd', 'sgp', 'jamin', 'tembus', 'silah', 'sms', 'mastertogel']"
"Kak, kirimkan dulu pulsa25rb di no baruku ini 085377771822",1,kak kirimkan dulu pulsarb di no baruku ini ,kak kirimkan dulu pulsarb di nomor baruku ini,kak kirimkan dulu pulsarb nomor baruku,kak kirim dulu pulsarb nomor baru,"['kak', 'kirim', 'dulu', 'pulsarb', 'nomor', 'baru']"
"Kami dr Ktr INDOSAT sdh hub nmr anda tp tdk trsambung,jd kami krm SMS bhw no anda mendpt mobil JAGUAR PIN;d377hi8 info www.kejutanindosat-plusplus.weebly.com",1,kami dr ktr indosat sdh hub nmr anda tp tdk trsambung jd kami krm sms bhw no anda mendpt mobil jaguar pin dhi info www kejutanindosat plusplus weebly com,kami dari kantor indosat sudah hub nomor anda tapi tidak trsambung jadi kami kirim sms bhw nomor anda mendpt mobil jaguar pin dhi informasi www kejutanindosat plusplus weebly com,dari kantor indosat hub nomor tapi trsambung jadi kirim sms bhw nomor mendpt mobil jaguar pin dhi informasi www kejutanindosat plusplus weebly com,dari kantor indosat hub nomor tapi trsambung jadi kirim sms bhw nomor mendpt mobil jaguar pin dhi informasi www kejutanindosat plusplus weebly com,"['dari', 'kantor', 'indosat', 'hub', 'nomor', 'tapi', 'trsambung', 'jadi', 'kirim', 'sms', 'bhw', 'nomor', 'mendpt', 'mobil', 'jaguar', 'pin', 'dhi', 'informasi', 'www', 'kejutanindosat', 'plusplus', 'weebly', 'com']"
Kami sdh mnghubungi tdk trsambung SIM CARD anda mendapatkan hadiah ketiga dri PT.AXIS pin [02399877] Klik  www.hadiah-ptaxis.blogspot.co.id,1,kami sdh mnghubungi tdk trsambung sim card anda mendapatkan hadiah ketiga dri pt axis pin  klik www hadiah ptaxis blogspot co id,kami sudah mnghubungi tidak trsambung sim card anda mendapatkan hadiah ketiga dari pt axis pin klik www hadiah ptaxis blogspot co id,sudah mnghubungi trsambung sim card mendapatkan hadiah ketiga pt axis pin klik www hadiah ptaxis blogspot co id,sudah mnghubungi trsambung sim card dapat hadiah tiga pt axis pin klik www hadiah ptaxis blogspot co id,"['sudah', 'mnghubungi', 'trsambung', 'sim', 'card', 'dapat', 'hadiah', 'tiga', 'pt', 'axis', 'pin', 'klik', 'www', 'hadiah', 'ptaxis', 'blogspot', 'co', 'id']"
"Kejutan POIN, hadian Rp 15 jt resmi diberikan untuk pemilik nomor 0812330xxxx. PIN-x7af2547. Untuk Info Kantor Pusat TELKOMSEL 021-23867047, 021-23867048.",1,kejutan poin hadian rp  jt resmi diberikan untuk pemilik nomor xxxx pin xaf untuk info kantor pusat telkomsel    ,kejutan poin hadian rp jt resmi diberikan untuk pemilik nomor xxxx pin xaf untuk informasi kantor pusat telkomsel,kejutan poin hadian rp jt resmi diberikan pemilik nomor xxxx pin xaf informasi kantor pusat telkomsel,kejut poin hadian rp jt resmi beri milik nomor xxxx pin xaf informasi kantor pusat telkomsel,"['kejut', 'poin', 'hadian', 'rp', 'jt', 'resmi', 'beri', 'milik', 'nomor', 'xxxx', 'pin', 'xaf', 'informasi', 'kantor', 'pusat', 'telkomsel']"
"Kemudahan dan Keamanan bisnis TOGEL kini Berbentuk online, Bergabung dan raih keberuntungan anda di www.brotogel6.com Satu-satunya situs togel online terpercaya",1,kemudahan dan keamanan bisnis togel kini berbentuk online bergabung dan raih keberuntungan anda di www brotogel com satu satunya situs togel online terpercaya,kemudahan dan keamanan bisnis toto gelap kini berbentuk online bergabung dan raih keberuntungan anda di www brotogel com satu satunya situs toto gelap online terpercaya,kemudahan keamanan bisnis toto gelap kini berbentuk online bergabung raih keberuntungan di www brotogel com satu satunya situs toto gelap online terpercaya,mudah aman bisnis toto gelap kini bentuk online gabung raih untung di www brotogel com satu satu situs toto gelap online percaya,"['mudah', 'aman', 'bisnis', 'toto', 'gelap', 'kini', 'bentuk', 'online', 'gabung', 'raih', 'untung', 'di', 'www', 'brotogel', 'com', 'satu', 'satu', 'situs', 'toto', 'gelap', 'online', 'percaya']"
Kepada yth bpk/ibu pelanggan tri saya sumargani dr OPERATOR tri plaza semanggi lt1 jl jend sudirman kav50 jkt pst kirim sms krn nmr anda sulit saya hubungi dengan hal sebagai berikut nmr anda mendapat HADIAH dr promo undian 2013 HADIAH KE4 SUZUKI ERTIGA PIN ANDA:7t899b3 info.www.promotri2013.jimdo.com,1,kepada yth bpk ibu pelanggan tri saya sumargani dr operator tri plaza semanggi lt jl jend sudirman kav jkt pst kirim sms krn nmr anda sulit saya hubungi dengan hal sebagai berikut nmr anda mendapat hadiah dr promo undian  hadiah ke suzuki ertiga pin anda tb info www promotri jimdo com,kepada yth bapak ibu pelanggan tri saya sumargani dari operator tri plaza semanggi lt jl jend sudirman kav jakarta pasti kirim sms karena nomor anda sulit saya hubungi dengan hal sebagai berikut nomor anda mendapat hadiah dari promo undian hadiah ke suzuki ertiga pin anda tb informasi www promotri jimdo com,yth bapak ibu pelanggan tri sumargani operator tri plaza semanggi lt jl jend sudirman kav jakarta kirim sms nomor sulit hubungi hal berikut nomor mendapat hadiah promo undian hadiah suzuki ertiga pin tb informasi www promotri jimdo com,yth bapak ibu langgan tri sumargani operator tri plaza semanggi lt jl jend sudirman kav jakarta kirim sms nomor sulit hubung hal ikut nomor dapat hadiah promo undi hadiah suzuki ertiga pin tb informasi www promotri jimdo com,"['yth', 'bapak', 'ibu', 'langgan', 'tri', 'sumargani', 'operator', 'tri', 'plaza', 'semanggi', 'lt', 'jl', 'jend', 'sudirman', 'kav', 'jakarta', 'kirim', 'sms', 'nomor', 'sulit', 'hubung', 'hal', 'ikut', 'nomor', 'dapat', 'hadiah', 'promo', 'undi', 'hadiah', 'suzuki', 'ertiga', 'pin', 'tb', 'informasi', 'www', 'promotri', 'jimdo', 'com']"
Keputusan resmi 3care selamat No.anda Terpilih M'dpt Tabungan Rp.35jt Pin:M902CX8J info kelik www.programisiulang3care.tk ,1,keputusan resmi care selamat no anda terpilih m dpt tabungan rp jt pin mcxj info kelik www programisiulangcare tk,keputusan resmi care selamat nomor anda terpilih m dapat tabungan rp jt pin mcxj informasi kelik www programisiulangcare tk,keputusan resmi care selamat nomor terpilih m tabungan rp jt pin mcxj informasi kelik www programisiulangcare tk,putus resmi care selamat nomor pilih m tabung rp jt pin mcxj informasi kelik www programisiulangcare tk,"['putus', 'resmi', 'care', 'selamat', 'nomor', 'pilih', 'm', 'tabung', 'rp', 'jt', 'pin', 'mcxj', 'informasi', 'kelik', 'www', 'programisiulangcare', 'tk']"
"Kesempatan jadi AGEN PULSA MKIOS ALL Operator harga V5=4500, V10=8500, V20=18rb, V25=23rb, V50=45rb, V100=90rb Cara Ketik Daftar kirim ke 087888366677",1,kesempatan jadi agen pulsa mkios all operator harga v  v  v rb v rb v rb v rb cara ketik daftar kirim ke ,kesempatan jadi agen pulsa mkios all operator harga v v v rb v rb v rb v rb cara ketik daftar kirim ke,kesempatan jadi agen pulsa mkios all operator harga v v v rb v rb v rb v rb cara ketik daftar kirim,sempat jadi agen pulsa mkios all operator harga v v v rb v rb v rb v rb cara ketik daftar kirim,"['sempat', 'jadi', 'agen', 'pulsa', 'mkios', 'all', 'operator', 'harga', 'v', 'v', 'v', 'rb', 'v', 'rb', 'v', 'rb', 'v', 'rb', 'cara', 'ketik', 'daftar', 'kirim']"
"Kesempatan menjadi agen pulsa/ALL Operator MKIOS, Harga murah; 5=4500, 10=8500, 20=18000, 25=22000, 50=45000, Ketik GABUNG Kirim ke 087775777917",1,kesempatan menjadi agen pulsa all operator mkios harga murah           ketik gabung kirim ke ,kesempatan menjadi agen pulsa all operator mkios harga murah ketik gabung kirim ke,kesempatan menjadi agen pulsa all operator mkios harga murah ketik gabung kirim,sempat jadi agen pulsa all operator mkios harga murah ketik gabung kirim,"['sempat', 'jadi', 'agen', 'pulsa', 'all', 'operator', 'mkios', 'harga', 'murah', 'ketik', 'gabung', 'kirim']"
Kirim ke Bank BCA No. Rek : 2731.7942.96 A/n : ANDRIANTO DJUNAEDI usahakan hari ini trms,1,kirim ke bank bca no rek    a n andrianto djunaedi usahakan hari ini trms,kirim ke bank bca nomor rek a dan andrianto djunaedi usahakan hari ini trms,kirim bank bca nomor rek a andrianto djunaedi usahakan hari trms,kirim bank bca nomor rek a andrianto djunaedi usaha hari trms,"['kirim', 'bank', 'bca', 'nomor', 'rek', 'a', 'andrianto', 'djunaedi', 'usaha', 'hari', 'trms']"
"Kirim ke MANDIRI aja, a/n ARYA. rek: 131-000-7252-937. klo sudah kabarin ya!",1,kirim ke mandiri aja a n arya rek     klo sudah kabarin ya,kirim ke mandiri saja a dan arya rek kalau sudah kabarin iya,kirim mandiri a arya rek kalau kabarin iya,kirim mandiri a arya rek kalau kabarin iya,"['kirim', 'mandiri', 'a', 'arya', 'rek', 'kalau', 'kabarin', 'iya']"
Kirimi dulu pulsa 20ewu di no ini 085285485839 Mas Agus,1,kirimi dulu pulsa ewu di no ini  mas agus,kirimi dulu pulsa ewu di nomor ini mas agus,kirimi dulu pulsa ewu nomor mas agus,kirim dulu pulsa ewu nomor mas agus,"['kirim', 'dulu', 'pulsa', 'ewu', 'nomor', 'mas', 'agus']"
km dari BANK BRI Sdh tlp tdk bs jd km SMS No.PIN Pemenang anda KG65H8K9 M-dpt HADIAH dari Untung Bliung BritAma Info klik www.HadiahkejutangBri.blogspot.com,1,km dari bank bri sdh tlp tdk bs jd km sms no pin pemenang anda kghk m dpt hadiah dari untung bliung britama info klik www hadiahkejutangbri blogspot com,kamu dari bank bri sudah telepon tidak bisa jadi kamu sms nomor pin pemenang anda kghk m dapat hadiah dari untung bliung britama informasi klik www hadiahkejutangbri blogspot com,kamu bank bri telepon bisa jadi kamu sms nomor pin pemenang kghk m hadiah untung bliung britama informasi klik www hadiahkejutangbri blogspot com,kamu bank bri telepon bisa jadi kamu sms nomor pin menang kghk m hadiah untung bliung britama informasi klik www hadiahkejutangbri blogspot com,"['kamu', 'bank', 'bri', 'telepon', 'bisa', 'jadi', 'kamu', 'sms', 'nomor', 'pin', 'menang', 'kghk', 'm', 'hadiah', 'untung', 'bliung', 'britama', 'informasi', 'klik', 'www', 'hadiahkejutangbri', 'blogspot', 'com']"
"Krim ke BNI aja a/n Ayu Suryani no rek 0215891174, klo sudah dikirim kabarin ya!",1,krim ke bni aja a n ayu suryani no rek  klo sudah dikirim kabarin ya,krim ke bni saja a dan ayu suryani nomor rek kalau sudah dikirim kabarin iya,krim bni a ayu suryani nomor rek kalau dikirim kabarin iya,krim bni a ayu suryani nomor rek kalau kirim kabarin iya,"['krim', 'bni', 'a', 'ayu', 'suryani', 'nomor', 'rek', 'kalau', 'kirim', 'kabarin', 'iya']"
Layanan VIP GAMES Rp3300/sms 4x/mgg sdh diperpanjang.Nikmati layanan disini:http://live.vipgames.me/?sid=40186483 stop? *123*66#. CS:02152971540,1,layanan vip games rp sms x mgg sdh diperpanjang nikmati layanan disini http live vipgames me sid  stop   cs ,layanan vip games rp sms x mgg sudah diperpanjang nikmati layanan disini http live vipgames me sid stop cs,layanan vip games rp sms x mgg diperpanjang nikmati layanan disini http live vipgames me sid stop cs,layan vip games rp sms x mgg panjang nikmat layan sini http live vipgames me sid stop cs,"['layan', 'vip', 'games', 'rp', 'sms', 'x', 'mgg', 'panjang', 'nikmat', 'layan', 'sini', 'http', 'live', 'vipgames', 'me', 'sid', 'stop', 'cs']"
"Ma"" belikan dulu besok pulsa 20rbu di no baruku ini 085340781778 penting",1,ma belikan dulu besok pulsa rbu di no baruku ini  penting,ma belikan dulu besok pulsa rbu di nomor baruku ini penting,ma belikan dulu besok pulsa rbu nomor baruku penting,ma belikan dulu besok pulsa rbu nomor baru penting,"['ma', 'belikan', 'dulu', 'besok', 'pulsa', 'rbu', 'nomor', 'baru', 'penting']"
"ma, isi dl pulsa 20 rb di nmr ini 085337784732",1,ma isi dl pulsa  rb di nmr ini ,ma isi dulu pulsa rb di nomor ini,ma isi dulu pulsa rb nomor,ma isi dulu pulsa rb nomor,"['ma', 'isi', 'dulu', 'pulsa', 'rb', 'nomor']"
Maaf kami sdah menghubungi tpi tdak tersambung No.Anda resmi meraih hadiah ke-2 dari PT.M-KIOS pin;M248K81 u/info hadiah klik; www.hadiah-mkios17.blogspot.com,1,maaf kami sdah menghubungi tpi tdak tersambung no anda resmi meraih hadiah ke  dari pt m kios pin mk u info hadiah klik www hadiah mkios blogspot com,maaf kami sdah menghubungi tapi tdak tersambung nomor anda resmi meraih hadiah ke dari pt m kios pin mk kamu informasi hadiah klik www hadiah mkios blogspot com,maaf sdah menghubungi tdak tersambung nomor resmi meraih hadiah dari pt m kios pin mk kamu informasi hadiah klik www hadiah mkios blogspot com,maaf sdah hubung tdak sambung nomor resmi raih hadiah dari pt m kios pin mk kamu informasi hadiah klik www hadiah mkios blogspot com,"['maaf', 'sdah', 'hubung', 'tdak', 'sambung', 'nomor', 'resmi', 'raih', 'hadiah', 'dari', 'pt', 'm', 'kios', 'pin', 'mk', 'kamu', 'informasi', 'hadiah', 'klik', 'www', 'hadiah', 'mkios', 'blogspot', 'com']"
Maaf kami sudah menghubungi tapi tidak tersambung No Anda meraih hadiah ke-2 dr. PT.MKIOS pin Anda M248K81 cek pin Anda di. www.pusat-m-kios7.blogspot.com,1,maaf kami sudah menghubungi tapi tidak tersambung no anda meraih hadiah ke  dr pt mkios pin anda mk cek pin anda di www pusat m kios blogspot com,maaf kami sudah menghubungi tapi tidak tersambung nomor anda meraih hadiah ke dari pt mkios pin anda mk cek pin anda di www pusat m kios blogspot com,maaf sudah menghubungi tidak tersambung nomor meraih hadiah dari pt mkios pin mk cek pin di www pusat m kios blogspot com,maaf sudah hubung tidak sambung nomor raih hadiah dari pt mkios pin mk cek pin di www pusat m kios blogspot com,"['maaf', 'sudah', 'hubung', 'tidak', 'sambung', 'nomor', 'raih', 'hadiah', 'dari', 'pt', 'mkios', 'pin', 'mk', 'cek', 'pin', 'di', 'www', 'pusat', 'm', 'kios', 'blogspot', 'com']"
Maaf kami sudah menghubungi tapi tidak tersambung Selamat No.Anda resmi meraih hadiah ke-3 dari PT.3CARE Pin ;b8337h9 u/info klik www.hadiah3care-2016.blogspot.com,1,maaf kami sudah menghubungi tapi tidak tersambung selamat no anda resmi meraih hadiah ke  dari pt care pin bh u info klik www hadiahcare  blogspot com,maaf kami sudah menghubungi tapi tidak tersambung selamat nomor anda resmi meraih hadiah ke dari pt care pin bh kamu informasi klik www hadiahcare blogspot com,maaf sudah menghubungi tidak tersambung selamat nomor resmi meraih hadiah dari pt care pin bh kamu informasi klik www hadiahcare blogspot com,maaf sudah hubung tidak sambung selamat nomor resmi raih hadiah dari pt care pin bh kamu informasi klik www hadiahcare blogspot com,"['maaf', 'sudah', 'hubung', 'tidak', 'sambung', 'selamat', 'nomor', 'resmi', 'raih', 'hadiah', 'dari', 'pt', 'care', 'pin', 'bh', 'kamu', 'informasi', 'klik', 'www', 'hadiahcare', 'blogspot', 'com']"
maaf kami sudah menghubungi tpi tdk tersmbung No.anda resmi meraih hadiah ke-2 dri PT.MKIOS PIN;M248K81 cek pin anda di www.hadiahresmi-mkios29.blogspot.com,1,maaf kami sudah menghubungi tpi tdk tersmbung no anda resmi meraih hadiah ke  dri pt mkios pin mk cek pin anda di www hadiahresmi mkios blogspot com,maaf kami sudah menghubungi tapi tidak tersmbung nomor anda resmi meraih hadiah ke dari pt mkios pin mk cek pin anda di www hadiahresmi mkios blogspot com,maaf sudah menghubungi tidak tersmbung nomor resmi meraih hadiah dari pt mkios pin mk cek pin di www hadiahresmi mkios blogspot com,maaf sudah hubung tidak tersmbung nomor resmi raih hadiah dari pt mkios pin mk cek pin di www hadiahresmi mkios blogspot com,"['maaf', 'sudah', 'hubung', 'tidak', 'tersmbung', 'nomor', 'resmi', 'raih', 'hadiah', 'dari', 'pt', 'mkios', 'pin', 'mk', 'cek', 'pin', 'di', 'www', 'hadiahresmi', 'mkios', 'blogspot', 'com']"
"Maaf saya Bu Nur, tanah yang di tanjung api-api saya sudah lihat dan sudah cocok, untuk masalah harga tolong hubungi suami saya aja, pak H.SULAIMAN di no hp. 08xxxxxx, karena kebetulan saya ada acara.Tks",1,maaf saya bu nur tanah yang di tanjung api api saya sudah lihat dan sudah cocok untuk masalah harga tolong hubungi suami saya aja pak h sulaiman di no hp xxxxxx karena kebetulan saya ada acara tks,maaf saya bu nur tanah yang di tanjung api api saya sudah lihat dan sudah cocok untuk masalah harga tolong hubungi suami saya saja pak h sulaiman di nomor hp xxxxxx karena kebetulan saya ada acara terima kasih,maaf bu nur tanah tanjung api api sudah lihat sudah cocok masalah harga hubungi suami saja pak h sulaiman di nomor hp xxxxxx kebetulan ada acara terima kasih,maaf bu nur tanah tanjung api api sudah lihat sudah cocok masalah harga hubung suami saja pak h sulaiman di nomor hp xxxxxx betul ada acara terima kasih,"['maaf', 'bu', 'nur', 'tanah', 'tanjung', 'api', 'api', 'sudah', 'lihat', 'sudah', 'cocok', 'masalah', 'harga', 'hubung', 'suami', 'saja', 'pak', 'h', 'sulaiman', 'di', 'nomor', 'hp', 'xxxxxx', 'betul', 'ada', 'acara', 'terima', 'kasih']"
"Maaf' Soal Angsuran bulan ini Pembayaran harus melalui ke bpk.Yogi, HP: 08562115779, soalnya sdh dikuasakan",1,maaf soal angsuran bulan ini pembayaran harus melalui ke bpk yogi hp  soalnya sdh dikuasakan,maaf soal angsuran bulan ini pembayaran harus melalui ke bapak yogi hp soalnya sudah dikuasakan,maaf soal angsuran bulan pembayaran melalui bapak yogi hp soalnya dikuasakan,maaf soal angsur bulan bayar lalu bapak yogi hp soal kuasa,"['maaf', 'soal', 'angsur', 'bulan', 'bayar', 'lalu', 'bapak', 'yogi', 'hp', 'soal', 'kuasa']"
"Maaf tolong uangnya ditransfer saja ke Bank xxx An. xxx No.Rek 2952149xxx, bila sudah ditransfer SMS saja, terima kasih",1,maaf tolong uangnya ditransfer saja ke bank xxx an xxx no rek xxx bila sudah ditransfer sms saja terima kasih,maaf tolong uangnya ditransfer saja ke bank xxx an xxx nomor rek xxx bila sudah ditransfer sms saja terima kasih,maaf uangnya ditransfer ke bank xxx an xxx nomor rek xxx bila ditransfer sms terima kasih,maaf uang transfer ke bank xxx an xxx nomor rek xxx bila transfer sms terima kasih,"['maaf', 'uang', 'transfer', 'ke', 'bank', 'xxx', 'an', 'xxx', 'nomor', 'rek', 'xxx', 'bila', 'transfer', 'sms', 'terima', 'kasih']"
"Maaf, hanya iklan penawaran pinjaman uang tunai tanpa jaminan KTA 5JT s.d 200JT dg KTP d KARTU KREDIT, Bunga Flat, simpan sms ni a/hub. 085717559229 ; 02199001886",1,maaf hanya iklan penawaran pinjaman uang tunai tanpa jaminan kta jt s d jt dg ktp d kartu kredit bunga flat simpan sms ni a hub  ,maaf hanya iklan penawaran pinjaman uang tunai tanpa jaminan kta jt s di jt dengan ktp di kartu kredit bunga flat simpan sms ini a hub,maaf iklan penawaran pinjaman uang tunai jaminan kta jt s jt ktp kartu kredit bunga flat simpan sms a hub,maaf iklan tawar pinjam uang tunai jamin kta jt s jt ktp kartu kredit bunga flat simpan sms a hub,"['maaf', 'iklan', 'tawar', 'pinjam', 'uang', 'tunai', 'jamin', 'kta', 'jt', 's', 'jt', 'ktp', 'kartu', 'kredit', 'bunga', 'flat', 'simpan', 'sms', 'a', 'hub']"
"Maaf‟ Cuma ingatkan soal kontrakan kalau mau diteruskan/bayar, Harap ke Bpk Chandra, No: 082374910777, Soalnya sys dh kuasakan sepenuhnya. Maaf Cuma sms",1,maaf cuma ingatkan soal kontrakan kalau mau diteruskan bayar harap ke bpk chandra no  soalnya sys dh kuasakan sepenuhnya maaf cuma sms,maaf cuma ingatkan soal kontrakan kalau mau diteruskan bayar harap ke bapak chandra nomor soalnya sys deh kuasakan sepenuhnya maaf cuma sms,maaf cuma ingatkan soal kontrakan kalau mau diteruskan bayar harap bapak chandra nomor soalnya sys deh kuasakan sepenuhnya maaf cuma sms,maaf cuma ingat soal kontra kalau mau terus bayar harap bapak chandra nomor soal sys deh kuasa sepenuh maaf cuma sms,"['maaf', 'cuma', 'ingat', 'soal', 'kontra', 'kalau', 'mau', 'terus', 'bayar', 'harap', 'bapak', 'chandra', 'nomor', 'soal', 'sys', 'deh', 'kuasa', 'sepenuh', 'maaf', 'cuma', 'sms']"
"Maaf…! saya bu RATNA meganai RUMAH saya Sudah liat, soalnya saya lagi di bandara silahkan hubungi suami saya H. ARIF ISKANDAR,SE hp:081218844557 trims.",1,maaf saya bu ratna meganai rumah saya sudah liat soalnya saya lagi di bandara silahkan hubungi suami saya h arif iskandar se hp  trims,maaf saya bu ratna meganai rumah saya sudah lihat soalnya saya lagi di bandara silahkan hubungi suami saya h arif iskandar se hp terima kasih,maaf bu ratna meganai rumah sudah lihat soalnya lagi bandara silahkan hubungi suami h arif iskandar se hp terima kasih,maaf bu ratna meganai rumah sudah lihat soal lagi bandara silah hubung suami h arif iskandar se hp terima kasih,"['maaf', 'bu', 'ratna', 'meganai', 'rumah', 'sudah', 'lihat', 'soal', 'lagi', 'bandara', 'silah', 'hubung', 'suami', 'h', 'arif', 'iskandar', 'se', 'hp', 'terima', 'kasih']"
