Teks,label,clean_text,normal_text,removedsw_text,stemmed_text,tokenized_text
"[PROMO] Beli paket Flash mulai 1GB di MY TELKOMSEL APP dpt EXTRA kuota 2GB 4G LTE dan EXTRA nelpon hingga 100mnt/1hr. Buruan, cek  di tsel.me/mytsel1 S&K",2,promo beli paket flash mulai gb di my telkomsel app dpt extra kuota gb g lte dan extra nelpon hingga mnt hr buruan cek di tsel me mytsel s k,promo beli paket flash mulai gb di my telkomsel app dapat extra kuota gb g lte dan extra nelpon hingga minta hari buruan cek di tsel me mytsel s ke,promo beli paket flash mulai gb my telkomsel app extra kuota gb g lte extra nelpon hingga minta hari buruan cek tsel me mytsel s,promo beli paket flash mulai gb my telkomsel app extra kuota gb g lte extra nelpon hingga minta hari buru cek tsel me mytsel s,"['promo', 'beli', 'paket', 'flash', 'mulai', 'gb', 'my', 'telkomsel', 'app', 'extra', 'kuota', 'gb', 'g', 'lte', 'extra', 'nelpon', 'hingga', 'minta', 'hari', 'buru', 'cek', 'tsel', 'me', 'mytsel', 's']"
2.5 GB/30 hari hanya Rp 35 Ribu Spesial buat Anda yang terpilih. Aktifkan sekarang juga di *550*905#. Promo sd 30 Nov 2015.Buruan aktifkan sekarang. S&K,2,  gb  hari hanya rp  ribu spesial buat anda yang terpilih aktifkan sekarang juga di   promo sd  nov  buruan aktifkan sekarang s k,gb hari hanya rp ribu spesial buat anda yang terpilih aktifkan sekarang juga di promo sd nov buruan aktifkan sekarang s ke,gb hari rp ribu spesial buat yang terpilih aktifkan sekarang di promo sd nov buruan aktifkan sekarang s,gb hari rp ribu spesial buat yang pilih aktif sekarang di promo sd nov buru aktif sekarang s,"['gb', 'hari', 'rp', 'ribu', 'spesial', 'buat', 'yang', 'pilih', 'aktif', 'sekarang', 'di', 'promo', 'sd', 'nov', 'buru', 'aktif', 'sekarang', 's']"
"2016-07-08 11:47:11.Plg Yth, sisa kuota Flash Anda 478KB. Download MyTelkomsel apps di http://tsel.me/tsel utk cek kuota&beli paket Flash atau hub *363#",2,      plg yth sisa kuota flash anda kb download mytelkomsel apps di http tsel me tsel utk cek kuota beli paket flash atau hub ,paling yth sisa kuota flash anda kb download mytelkomsel apps di http tsel me tsel untuk cek kuota beli paket flash atau hub,paling yth sisa kuota flash kb download mytelkomsel apps http tsel me tsel cek kuota beli paket flash hub,paling yth sisa kuota flash kb download mytelkomsel apps http tsel me tsel cek kuota beli paket flash hub,"['paling', 'yth', 'sisa', 'kuota', 'flash', 'kb', 'download', 'mytelkomsel', 'apps', 'http', 'tsel', 'me', 'tsel', 'cek', 'kuota', 'beli', 'paket', 'flash', 'hub']"
"2016-08-07 11:29:47.Plg Yth, sisa kuota Flash Anda 7160KB. Download MyTelkomsel apps di http://tsel.me/tsel utk cek kuota&beli paket Flash atau hub *363#",2,      plg yth sisa kuota flash anda kb download mytelkomsel apps di http tsel me tsel utk cek kuota beli paket flash atau hub ,paling yth sisa kuota flash anda kb download mytelkomsel apps di http tsel me tsel untuk cek kuota beli paket flash atau hub,paling yth sisa kuota flash kb download mytelkomsel apps http tsel me tsel cek kuota beli paket flash hub,paling yth sisa kuota flash kb download mytelkomsel apps http tsel me tsel cek kuota beli paket flash hub,"['paling', 'yth', 'sisa', 'kuota', 'flash', 'kb', 'download', 'mytelkomsel', 'apps', 'http', 'tsel', 'me', 'tsel', 'cek', 'kuota', 'beli', 'paket', 'flash', 'hub']"
4.5GB/30 hari hanya Rp 55 Ribu Spesial buat anda yang terpilih. Aktifkan sekarang juga di *550*907# Buruan..! SKB,2, gb  hari hanya rp  ribu spesial buat anda yang terpilih aktifkan sekarang juga di   buruan skb,gb hari hanya rp ribu spesial buat anda yang terpilih aktifkan sekarang juga di buruan skb,gb hari rp ribu spesial buat yang terpilih aktifkan sekarang di buruan skb,gb hari rp ribu spesial buat yang pilih aktif sekarang di buru skb,"['gb', 'hari', 'rp', 'ribu', 'spesial', 'buat', 'yang', 'pilih', 'aktif', 'sekarang', 'di', 'buru', 'skb']"
5 HARI LAGI ! EKSTRA Pulsa 50rb dg beli paket internet bulanan di MyTelkomsel utk pembelian pertama sjk 25Aug-25Sept. Cek detail promo di tsel.me/mytsel1,2, hari lagi ekstra pulsa rb dg beli paket internet bulanan di mytelkomsel utk pembelian pertama sjk aug sept cek detail promo di tsel me mytsel,hari lagi ekstra pulsa rb dengan beli paket internet bulanan di mytelkomsel untuk pembelian pertama sjk aug sept cek detail promo di tsel me mytsel,hari ekstra pulsa rb beli paket internet bulanan mytelkomsel pembelian pertama sjk aug sept cek detail promo tsel me mytsel,hari ekstra pulsa rb beli paket internet bulan mytelkomsel beli pertama sjk aug sept cek detail promo tsel me mytsel,"['hari', 'ekstra', 'pulsa', 'rb', 'beli', 'paket', 'internet', 'bulan', 'mytelkomsel', 'beli', 'pertama', 'sjk', 'aug', 'sept', 'cek', 'detail', 'promo', 'tsel', 'me', 'mytsel']"
"Ada iRing dgn tarif Rp. 0,1/7hr (perpanjangan Rp. 3190/7hr) dari hits Armada - Pencuri Hati. Tekan *808*3*1*4*1# lalu OK/Call. Info: 100&111",2,ada iring dgn tarif rp   hr perpanjangan rp  hr dari hits armada pencuri hati tekan      lalu ok call info  ,ada iring dengan tarif rp hari perpanjangan rp hari dari hits armada pencuri hati tekan lalu ok call informasi,iring tarif rp hari perpanjangan rp hari hits armada pencuri hati tekan lalu call informasi,iring tarif rp hari panjang rp hari hits armada curi hati tekan lalu call informasi,"['iring', 'tarif', 'rp', 'hari', 'panjang', 'rp', 'hari', 'hits', 'armada', 'curi', 'hati', 'tekan', 'lalu', 'call', 'informasi']"
Akhir bulan harus tetap eksis loh! Internetan pake volume ultima 900MB/30hr. Hrga mulai Rp 35rb di *100*471#. Tarif&lokasi cek di tsel.me/fl,2,akhir bulan harus tetap eksis loh internetan pake volume ultima mb hr hrga mulai rp rb di   tarif lokasi cek di tsel me fl,akhir bulan harus tetap eksis loh internetan pakai volume ultima mb hari hrga mulai rp rb di tarif lokasi cek di tsel me fl,akhir bulan tetap eksis loh internetan pakai volume ultima mb hari hrga mulai rp rb tarif lokasi cek tsel me fl,akhir bulan tetap eks loh internetan pakai volume ultima mb hari hrga mulai rp rb tarif lokasi cek tsel me fl,"['akhir', 'bulan', 'tetap', 'eks', 'loh', 'internetan', 'pakai', 'volume', 'ultima', 'mb', 'hari', 'hrga', 'mulai', 'rp', 'rb', 'tarif', 'lokasi', 'cek', 'tsel', 'me', 'fl']"
"Aktifkan iRing Coboy Jr - Terhebat. Tekan *808*7#. Info: 100&111 Ada hits terbaru dari NOAH - Jika Engkau. Aktifkan iRing nya di HP kamu. Ketik MG NOAH02 kirim ke 808 Info: 100&111 Berkah iRing Rp 1000 dr Yuni Shara - Akhirnya. Aktifkan iRing nya, Tkn *808*1*2*3# lalu Ok/Call. Raih THR PuluhanJt!. Berhenti: Unreg ke 808",2,aktifkan iring coboy jr terhebat tekan   info   ada hits terbaru dari noah jika engkau aktifkan iring nya di hp kamu ketik mg noah kirim ke  info   berkah iring rp  dr yuni shara akhirnya aktifkan iring nya tkn     lalu ok call raih thr puluhanjt berhenti unreg ke ,aktifkan iring coboy jr terhebat tekan informasi ada hits terbaru dari noah jika engkau aktifkan iring nya di hp kamu ketik mg noah kirim ke informasi berkah iring rp dari yuni shara akhirnya aktifkan iring nya tkn lalu ok call raih thr puluhanjt berhenti unreg ke,aktifkan iring coboy jr terhebat tekan informasi hits terbaru noah engkau aktifkan iring nya hp kamu ketik mg noah kirim informasi berkah iring rp yuni shara akhirnya aktifkan iring nya tkn lalu call raih thr puluhanjt berhenti unreg,aktif iring coboy jr hebat tekan informasi hits baru noah engkau aktif iring nya hp kamu ketik mg noah kirim informasi berkah iring rp yuni shara akhir aktif iring nya tkn lalu call raih thr puluhanjt henti unreg,"['aktif', 'iring', 'coboy', 'jr', 'hebat', 'tekan', 'informasi', 'hits', 'baru', 'noah', 'engkau', 'aktif', 'iring', 'nya', 'hp', 'kamu', 'ketik', 'mg', 'noah', 'kirim', 'informasi', 'berkah', 'iring', 'rp', 'yuni', 'shara', 'akhir', 'aktif', 'iring', 'nya', 'tkn', 'lalu', 'call', 'raih', 'thr', 'puluhanjt', 'henti', 'unreg']"
Ambil bonus harianmu di *600# (Bebas Pulsa). Dptkan gratis nelpon atau internetan dan promo lainnya sesuai hobimu!,2,ambil bonus harianmu di  bebas pulsa dptkan gratis nelpon atau internetan dan promo lainnya sesuai hobimu,ambil bonus harianmu di bebas pulsa dptkan gratis nelpon atau internetan dan promo lainnya sesuai hobimu,ambil bonus harianmu bebas pulsa dptkan gratis nelpon internetan promo lainnya sesuai hobimu,ambil bonus hari bebas pulsa dptkan gratis nelpon internetan promo lain sesuai hobi,"['ambil', 'bonus', 'hari', 'bebas', 'pulsa', 'dptkan', 'gratis', 'nelpon', 'internetan', 'promo', 'lain', 'sesuai', 'hobi']"
Anda akan berhenti berlangganan Paket Flash. Ketik FLASH<spasi>YA jika setuju. Tunggu SMS konfirmasi penonaktifan Paket Anda,2,anda akan berhenti berlangganan paket flash ketik flash spasi ya jika setuju tunggu sms konfirmasi penonaktifan paket anda,anda akan berhenti berlangganan paket flash ketik flash spasi iya jika setuju tunggu sms konfirmasi penonaktifan paket anda,akan berhenti berlangganan paket flash ketik flash spasi iya setuju tunggu sms konfirmasi penonaktifan paket,akan henti langgan paket flash ketik flash spasi iya tuju tunggu sms konfirmasi nonaktif paket,"['akan', 'henti', 'langgan', 'paket', 'flash', 'ketik', 'flash', 'spasi', 'iya', 'tuju', 'tunggu', 'sms', 'konfirmasi', 'nonaktif', 'paket']"
Anda akan berlangganan paket Rp. 10000 utk 150 MB 2G/3G + 250 MB 3G/90hari. Jika setuju balas FLASH<spasi>YA kirim ke 3636 utk melanjutkan. Paket diperpanjang pada akhir masa aktif dengan tarif sesuai lokasi Anda. Tunggu SMS konfirmasi sblm pemakaian. Info zona dan detail tarif lihat di Tsel.me/internet,2,anda akan berlangganan paket rp  utk  mb g g  mb g hari jika setuju balas flash spasi ya kirim ke  utk melanjutkan paket diperpanjang pada akhir masa aktif dengan tarif sesuai lokasi anda tunggu sms konfirmasi sblm pemakaian info zona dan detail tarif lihat di tsel me internet,anda akan berlangganan paket rp untuk mb g g mb g hari jika setuju balas flash spasi iya kirim ke untuk melanjutkan paket diperpanjang pada akhir masa aktif dengan tarif sesuai lokasi anda tunggu sms konfirmasi sebelum pemakaian informasi zona dan detail tarif lihat di tsel me internet,akan berlangganan paket rp mb g g mb g hari setuju balas flash spasi iya kirim untuk melanjutkan paket diperpanjang akhir masa aktif tarif sesuai lokasi tunggu sms konfirmasi pemakaian informasi zona detail tarif lihat tsel me internet,akan langgan paket rp mb g g mb g hari tuju balas flash spasi iya kirim untuk lanjut paket panjang akhir masa aktif tarif sesuai lokasi tunggu sms konfirmasi pakai informasi zona detail tarif lihat tsel me internet,"['akan', 'langgan', 'paket', 'rp', 'mb', 'g', 'g', 'mb', 'g', 'hari', 'tuju', 'balas', 'flash', 'spasi', 'iya', 'kirim', 'untuk', 'lanjut', 'paket', 'panjang', 'akhir', 'masa', 'aktif', 'tarif', 'sesuai', 'lokasi', 'tunggu', 'sms', 'konfirmasi', 'pakai', 'informasi', 'zona', 'detail', 'tarif', 'lihat', 'tsel', 'me', 'internet']"
"Anda akan membeli Paket Gampang Internetan Rp.1250 utk Chatting Sepuasnya (BBM, WhatsApp dan Line)/1 hari.Jika setuju balas FLASH<spasi>YA kirim ke 3636 utk melanjutkan.Tunggu SMS konfirmasi sblm pemakaian.Info detail tariff lihat di Tsel.me/internet ",2,anda akan membeli paket gampang internetan rp  utk chatting sepuasnya bbm whatsapp dan line  hari jika setuju balas flash spasi ya kirim ke  utk melanjutkan tunggu sms konfirmasi sblm pemakaian info detail tariff lihat di tsel me internet,anda akan membeli paket gampang internetan rp untuk chatting sepuasnya bbm whatsapp dan line hari jika setuju balas flash spasi iya kirim ke untuk melanjutkan tunggu sms konfirmasi sebelum pemakaian informasi detail tariff lihat di tsel me internet,akan membeli paket gampang internetan rp chatting sepuasnya bbm whatsapp line hari setuju balas flash spasi iya kirim untuk melanjutkan tunggu sms konfirmasi pemakaian informasi detail tariff lihat tsel me internet,akan beli paket gampang internetan rp chatting puas bbm whatsapp line hari tuju balas flash spasi iya kirim untuk lanjut tunggu sms konfirmasi pakai informasi detail tariff lihat tsel me internet,"['akan', 'beli', 'paket', 'gampang', 'internetan', 'rp', 'chatting', 'puas', 'bbm', 'whatsapp', 'line', 'hari', 'tuju', 'balas', 'flash', 'spasi', 'iya', 'kirim', 'untuk', 'lanjut', 'tunggu', 'sms', 'konfirmasi', 'pakai', 'informasi', 'detail', 'tariff', 'lihat', 'tsel', 'me', 'internet']"
"Anda akan menerima setting ponsel, agar ponsel Anda dapat mengakses internet dan berkirim foto/MMS. Jika Anda setuju balas pesan ini (gratis) dengan ketik Y.",2,anda akan menerima setting ponsel agar ponsel anda dapat mengakses internet dan berkirim foto mms jika anda setuju balas pesan ini gratis dengan ketik y,anda akan menerima setting telepon seluler agar telepon seluler anda dapat mengakses internet dan berkirim foto mms jika anda setuju balas pesan ini gratis dengan ketik kenapa,akan menerima setting telepon seluler telepon seluler dapat mengakses internet berkirim foto mms anda setuju balas pesan gratis ketik,akan terima setting telepon seluler telepon seluler dapat akses internet kirim foto mms anda tuju balas pesan gratis ketik,"['akan', 'terima', 'setting', 'telepon', 'seluler', 'telepon', 'seluler', 'dapat', 'akses', 'internet', 'kirim', 'foto', 'mms', 'anda', 'tuju', 'balas', 'pesan', 'gratis', 'ketik']"
Anda akan mengaktifkan Paket BBM Gratis berlaku 30 hari dari pertama kali aktivasi. Ketik FLASH (spasi) YA untuk melanjutkan,2,anda akan mengaktifkan paket bbm gratis berlaku  hari dari pertama kali aktivasi ketik flash spasi ya untuk melanjutkan,anda akan mengaktifkan paket bbm gratis berlaku hari dari pertama kali aktivasi ketik flash spasi iya untuk melanjutkan,akan mengaktifkan paket bbm gratis berlaku hari pertama kali aktivasi ketik flash spasi iya melanjutkan,akan aktif paket bbm gratis laku hari pertama kali aktivasi ketik flash spasi iya lanjut,"['akan', 'aktif', 'paket', 'bbm', 'gratis', 'laku', 'hari', 'pertama', 'kali', 'aktivasi', 'ketik', 'flash', 'spasi', 'iya', 'lanjut']"
Anda mendapatkan 1 kupon dalam program Kartu As BIBER (Beli Internet Berhadiah). Cek total kupon maksimal 1x24 jam dari skrg di *100*123#. Info lengkap hub:188,2,anda mendapatkan  kupon dalam program kartu as biber beli internet berhadiah cek total kupon maksimal x jam dari skrg di   info lengkap hub ,anda mendapatkan kupon dalam program kartu as biber beli internet berhadiah cek total kupon maksimal x jam dari sekarang di informasi lengkap hub,mendapatkan kupon program kartu as biber beli internet berhadiah cek total kupon maksimal x jam sekarang informasi lengkap hub,dapat kupon program kartu as biber beli internet hadiah cek total kupon maksimal x jam sekarang informasi lengkap hub,"['dapat', 'kupon', 'program', 'kartu', 'as', 'biber', 'beli', 'internet', 'hadiah', 'cek', 'total', 'kupon', 'maksimal', 'x', 'jam', 'sekarang', 'informasi', 'lengkap', 'hub']"
Anda sedang menikmati Paket Reguler dgn sisa kuota 209715 KB.Dapatkan beragam Paket INTERNET HEMAT Tri di *123*3#,2,anda sedang menikmati paket reguler dgn sisa kuota  kb dapatkan beragam paket internet hemat tri di  ,anda sedang menikmati paket reguler dengan sisa kuota kb dapatkan beragam paket internet hemat tri di,sedang menikmati paket reguler sisa kuota kb dapatkan beragam paket internet hemat tri,sedang nikmat paket reguler sisa kuota kb dapat agam paket internet hemat tri,"['sedang', 'nikmat', 'paket', 'reguler', 'sisa', 'kuota', 'kb', 'dapat', 'agam', 'paket', 'internet', 'hemat', 'tri']"
Anda tidak terdaftar dalam layanan Paket Malam hari. Untuk berlangganan lakukan isi ulang dengan voucher Kenyang Download,2,anda tidak terdaftar dalam layanan paket malam hari untuk berlangganan lakukan isi ulang dengan voucher kenyang download,anda tidak terdaftar dalam layanan paket malam hari untuk berlangganan lakukan isi ulang dengan voucher kenyang download,tidak terdaftar layanan paket malam hari berlangganan lakukan isi ulang voucher kenyang download,tidak daftar layan paket malam hari langgan laku isi ulang voucher kenyang download,"['tidak', 'daftar', 'layan', 'paket', 'malam', 'hari', 'langgan', 'laku', 'isi', 'ulang', 'voucher', 'kenyang', 'download']"
"Anda tlh menukarkan poin 95 poin, Tukarkan terus poinnya siapa tahu anda pemenang hadih LG G3 32gb, pemenang adalah yang menukarkan poin tertinggi s/d 30 November 15",2,anda tlh menukarkan poin  poin tukarkan terus poinnya siapa tahu anda pemenang hadih lg g gb pemenang adalah yang menukarkan poin tertinggi s d  november ,anda tlh menukarkan poin poin tukarkan terus poinnya siapa tahu anda pemenang hadih lagi g gb pemenang adalah yang menukarkan poin tertinggi s di november,tlh menukarkan poin poin tukarkan terus poinnya siapa tahu pemenang hadih g gb pemenang yang menukarkan poin tertinggi s november,tlh tukar poin poin tukar terus poin siapa tahu menang hadih g gb menang yang tukar poin tinggi s november,"['tlh', 'tukar', 'poin', 'poin', 'tukar', 'terus', 'poin', 'siapa', 'tahu', 'menang', 'hadih', 'g', 'gb', 'menang', 'yang', 'tukar', 'poin', 'tinggi', 's', 'november']"
AngpaoPoinSenyum! Dptkan Vchr Lottemart 50rb dg tukar 2500poin (normal 5000poin) sd 11Feb16. Ketik *123*7887*2*5# TERBATAS! Info: www.indosatooredoo.com/angpao,2,angpaopoinsenyum dptkan vchr lottemart rb dg tukar poin normal poin sd feb ketik     terbatas info www indosatooredoo com angpao,angpaopoinsenyum dptkan vchr lottemart rb dengan tukar poin normal poin sd feb ketik terbatas informasi www indosatooredoo com angpao,angpaopoinsenyum dptkan vchr lottemart rb tukar poin normal poin sd feb ketik terbatas informasi www indosatooredoo com angpao,angpaopoinsenyum dptkan vchr lottemart rb tukar poin normal poin sd feb ketik batas informasi www indosatooredoo com angpao,"['angpaopoinsenyum', 'dptkan', 'vchr', 'lottemart', 'rb', 'tukar', 'poin', 'normal', 'poin', 'sd', 'feb', 'ketik', 'batas', 'informasi', 'www', 'indosatooredoo', 'com', 'angpao']"
Awal bulan saat nya anda eksis lebih lama! Internetan pake volume ultima 900MB/30hr. Hrga mulai Rp 35rb di *100*471#. Tarif&lokasi cek di tsel.me/FL,2,awal bulan saat nya anda eksis lebih lama internetan pake volume ultima mb hr hrga mulai rp rb di   tarif lokasi cek di tsel me fl,awal bulan saat nya anda eksis lebih lama internetan pakai volume ultima mb hari hrga mulai rp rb di tarif lokasi cek di tsel me fl,awal bulan nya eksis lebih lama internetan pakai volume ultima mb hari hrga mulai rp rb tarif lokasi cek tsel me fl,awal bulan nya eks lebih lama internetan pakai volume ultima mb hari hrga mulai rp rb tarif lokasi cek tsel me fl,"['awal', 'bulan', 'nya', 'eks', 'lebih', 'lama', 'internetan', 'pakai', 'volume', 'ultima', 'mb', 'hari', 'hrga', 'mulai', 'rp', 'rb', 'tarif', 'lokasi', 'cek', 'tsel', 'me', 'fl']"
"Ayam (sayap/paha bawah), Nasi, Perkedel Rp. 19.545. GRATIS Teh Pucuk. Tukar SMS ini di CFC HASAN SADIKIN hari ini. Selama Persediaan msh ada. Promo *606#",2,ayam sayap paha bawah nasi perkedel rp   gratis teh pucuk tukar sms ini di cfc hasan sadikin hari ini selama persediaan msh ada promo ,ayam sayap paha bawah nasi perkedel rp gratis kakak perempuan pucuk tukar sms ini di cfc hasan sadikin hari ini selama persediaan masih ada promo,ayam sayap paha bawah nasi perkedel rp gratis kakak perempuan pucuk tukar sms di cfc hasan sadikin hari selama persediaan ada promo,ayam sayap paha bawah nasi perkedel rp gratis kakak perempuan pucuk tukar sms di cfc hasan sadikin hari lama sedia ada promo,"['ayam', 'sayap', 'paha', 'bawah', 'nasi', 'perkedel', 'rp', 'gratis', 'kakak', 'perempuan', 'pucuk', 'tukar', 'sms', 'di', 'cfc', 'hasan', 'sadikin', 'hari', 'lama', 'sedia', 'ada', 'promo']"
"Ayo anak Medan, beli sticker line dengan pulsamu Caranya klik http://www.telkomsel.com/linestore nama stickernya : Kedan Medan",2,ayo anak medan beli sticker line dengan pulsamu caranya klik http www telkomsel com linestore nama stickernya kedan medan,ayo anak medan beli sticker line dengan pulsamu caranya klik http www telkomsel com linestore nama stickernya kedan medan,ayo anak medan beli sticker line pulsamu caranya klik http www telkomsel com linestore nama stickernya kedan medan,ayo anak medan beli sticker line pulsa cara klik http www telkomsel com linestore nama stickernya dan medan,"['ayo', 'anak', 'medan', 'beli', 'sticker', 'line', 'pulsa', 'cara', 'klik', 'http', 'www', 'telkomsel', 'com', 'linestore', 'nama', 'stickernya', 'dan', 'medan']"
AYO download AXISnet dari Apple/Play Store dan aktifkan BRONET24Jam 5GB 60hr Rp44900 dan BRONET24Jam 1GB 30hr dapat OBOR 5GB (00-06) Rp18800. Info838. LD335,2,ayo download axisnet dari apple play store dan aktifkan bronetjam gb hr rp dan bronetjam gb hr dapat obor gb   rp info ld,ayo download axisnet dari apple play store dan aktifkan bronetjam gb hari rp dan bronetjam gb hari dapat obor gb rp informasi ld,ayo download axisnet apple play store aktifkan bronetjam gb hari rp bronetjam gb hari obor gb rp informasi ld,ayo download axisnet apple play store aktif bronetjam gb hari rp bronetjam gb hari obor gb rp informasi ld,"['ayo', 'download', 'axisnet', 'apple', 'play', 'store', 'aktif', 'bronetjam', 'gb', 'hari', 'rp', 'bronetjam', 'gb', 'hari', 'obor', 'gb', 'rp', 'informasi', 'ld']"
AYO download AXISnet dari PLAY/Apple Store dan aktifkan BRONET24Jam 5GB 60hr Rp44900 dan BRONET24Jam 3GB 60hr dapat OBOR 10GB (00-06) Rp39800. Info838. LD307,2,ayo download axisnet dari play apple store dan aktifkan bronetjam gb hr rp dan bronetjam gb hr dapat obor gb   rp info ld,ayo download axisnet dari play apple store dan aktifkan bronetjam gb hari rp dan bronetjam gb hari dapat obor gb rp informasi ld,ayo download axisnet play apple store aktifkan bronetjam gb hari rp bronetjam gb hari obor gb rp informasi ld,ayo download axisnet play apple store aktif bronetjam gb hari rp bronetjam gb hari obor gb rp informasi ld,"['ayo', 'download', 'axisnet', 'play', 'apple', 'store', 'aktif', 'bronetjam', 'gb', 'hari', 'rp', 'bronetjam', 'gb', 'hari', 'obor', 'gb', 'rp', 'informasi', 'ld']"
Ayo dukung pelestarian alam Indonesia bersama Indosat Ooredoo dan WWF-Indonesia dg berdonasi melalui *123*50# dari nomor Indosat Ooredoo.,2,ayo dukung pelestarian alam indonesia bersama indosat ooredoo dan wwf indonesia dg berdonasi melalui   dari nomor indosat ooredoo,ayo dukung pelestarian alam indonesia bersama indosat ooredoo dan wwf indonesia dengan berdonasi melalui dari nomor indosat ooredoo,ayo dukung pelestarian alam indonesia bersama indosat ooredoo wwf indonesia berdonasi melalui nomor indosat ooredoo,ayo dukung lestari alam indonesia sama indosat ooredoo wwf indonesia donasi lalu nomor indosat ooredoo,"['ayo', 'dukung', 'lestari', 'alam', 'indonesia', 'sama', 'indosat', 'ooredoo', 'wwf', 'indonesia', 'donasi', 'lalu', 'nomor', 'indosat', 'ooredoo']"
"Ayo kawal pemanfaatan subsidi BBM & Kompensasi bagi yang berhak! Pengaduan, ketik BBM (spasi) isi pesan. Kirim 1708",2,ayo kawal pemanfaatan subsidi bbm kompensasi bagi yang berhak pengaduan ketik bbm spasi isi pesan kirim ,ayo kawal pemanfaatan subsidi bbm kompensasi bagi yang berhak pengaduan ketik bbm spasi isi pesan kirim,ayo kawal pemanfaatan subsidi bbm kompensasi yang berhak pengaduan ketik bbm spasi isi pesan kirim,ayo kawal manfaat subsidi bbm kompensasi yang hak adu ketik bbm spasi isi pesan kirim,"['ayo', 'kawal', 'manfaat', 'subsidi', 'bbm', 'kompensasi', 'yang', 'hak', 'adu', 'ketik', 'bbm', 'spasi', 'isi', 'pesan', 'kirim']"
"BANTING HARGA !! Internetan dgn Kuota 1,5GB HANYA 10rb Rupiah, paket Berlaku sebulan. Mau?? Ketik YA ke 919 s/d 16 Desember 2015",2,banting harga internetan dgn kuota  gb hanya rb rupiah paket berlaku sebulan mau ketik ya ke  s d  desember ,banting harga internetan dengan kuota gb hanya rb rupiah paket berlaku sebulan mau ketik iya ke s di desember,banting harga internetan kuota gb rb rupiah paket berlaku sebulan mau ketik iya s desember,banting harga internetan kuota gb rb rupiah paket laku bulan mau ketik iya s desember,"['banting', 'harga', 'internetan', 'kuota', 'gb', 'rb', 'rupiah', 'paket', 'laku', 'bulan', 'mau', 'ketik', 'iya', 's', 'desember']"
BEBAS ekspresikan dirimu bersama Paket Freedom Combo dari Indosat Ooredoo. Segera hub *123# atau www.indosatooredoo.com/freedom,2,bebas ekspresikan dirimu bersama paket freedom combo dari indosat ooredoo segera hub  atau www indosatooredoo com freedom,bebas ekspresikan dirimu bersama paket freedom combo dari indosat ooredoo segera hub atau www indosatooredoo com freedom,bebas ekspresikan dirimu bersama paket freedom combo indosat ooredoo segera hub www indosatooredoo com freedom,bebas ekspresi diri sama paket freedom combo indosat ooredoo segera hub www indosatooredoo com freedom,"['bebas', 'ekspresi', 'diri', 'sama', 'paket', 'freedom', 'combo', 'indosat', 'ooredoo', 'segera', 'hub', 'www', 'indosatooredoo', 'com', 'freedom']"
Bebas Pulsa! Ambil bonusmu di *600# (GRATIS). Dptkan gratis nelpon atau internetas atau promo lainnya sesuai hobimu!,2,bebas pulsa ambil bonusmu di  gratis dptkan gratis nelpon atau internetas atau promo lainnya sesuai hobimu,bebas pulsa ambil bonusmu di gratis dptkan gratis nelpon atau internetas atau promo lainnya sesuai hobimu,bebas pulsa ambil bonusmu gratis dptkan gratis nelpon internetas promo lainnya sesuai hobimu,bebas pulsa ambil bonus gratis dptkan gratis nelpon internetas promo lain sesuai hobi,"['bebas', 'pulsa', 'ambil', 'bonus', 'gratis', 'dptkan', 'gratis', 'nelpon', 'internetas', 'promo', 'lain', 'sesuai', 'hobi']"
