Teks,label,clean_text,normal_text,removedsw_text,stemmed_text,tokenized_text
"Harap jangan sampaikan KODE RAHASIA ini kepada siapa pun, termasuk Bukalapak. Silakan masukkan otentikasi: 234567",3,harap jangan sampaikan kode rahasia ini kepada siapa pun termasuk bukalapak silakan masukkan otentikasi ,harap jangan sampaikan kode rahasia ini kepada siapa pun termasuk bukalapak silakan masukkan otentikasi,harap jangan sampaikan kode rahasia kepada siapa termasuk bukalapak silakan masukkan otentikasi,harap jangan sampai kode rahasia kepada siapa masuk bukalapak sila masuk otentikasi,"['harap', 'jangan', 'sampai', 'kode', 'rahasia', 'kepada', 'siapa', 'masuk', 'bukalapak', 'sila', 'masuk', 'otentikasi']"
"Tolong jangan sebarkan kode ini, bahkan kepada Tim SeaBank! Jika tidak, hubungi 08001500130. Kode OTP 789012 untuk akses akun pada perangkat baru.",3,tolong jangan sebarkan kode ini bahkan kepada tim seabank jika tidak hubungi  kode otp  untuk akses akun pada perangkat baru,tolong jangan sebarkan kode ini bahkan kepada tim seabank jika tidak hubungi kode otp untuk akses akun pada perangkat baru,jangan sebarkan kode bahkan tim seabank tidak hubungi kode otp akses akun perangkat baru,jangan sebar kode bahkan tim seabank tidak hubung kode otp akses akun perangkat baru,"['jangan', 'sebar', 'kode', 'bahkan', 'tim', 'seabank', 'tidak', 'hubung', 'kode', 'otp', 'akses', 'akun', 'perangkat', 'baru']"
Kode verifikasi Google Anda: G-215996,3,kode verifikasi google anda g ,kode verifikasi google anda g,kode verifikasi google g,kode verifikasi google g,"['kode', 'verifikasi', 'google', 'g']"
"Mohon gunakan kode OTP 4567 untuk akses akun Gojek-mu. Jangan berikan kepada siapa pun, bahkan yang mengklaim sebagai Gojek.",3,mohon gunakan kode otp  untuk akses akun gojek mu jangan berikan kepada siapa pun bahkan yang mengklaim sebagai gojek,mohon gunakan kode otp untuk akses akun gojek mu jangan berikan kepada siapa pun bahkan yang mengklaim sebagai gojek,mohon gunakan kode otp akses akun gojek mu jangan berikan siapa bahkan mengklaim gojek,mohon guna kode otp akses akun gojek mu jangan ikan siapa bahkan klaim gojek,"['mohon', 'guna', 'kode', 'otp', 'akses', 'akun', 'gojek', 'mu', 'jangan', 'ikan', 'siapa', 'bahkan', 'klaim', 'gojek']"
"Kode verifikasi: 456789. RAHASIAKAN kode ini. Jika tidak diminta, abaikan. Info di linkaja.id",3,kode verifikasi  rahasiakan kode ini jika tidak diminta abaikan info di linkaja id,kode verifikasi rahasiakan kode ini jika tidak diminta abaikan informasi di linkaja id,kode verifikasi rahasiakan kode jika diminta abaikan informasi linkaja id,kode verifikasi rahasia kode jika minta abai informasi linkaja id,"['kode', 'verifikasi', 'rahasia', 'kode', 'jika', 'minta', 'abai', 'informasi', 'linkaja', 'id']"
Kode Instagram Anda: 456789. Jangan dibagikan.,3,kode instagram anda  jangan dibagikan,kode instagram anda jangan dibagikan,kode instagram jangan dibagikan,kode instagram jangan bagi,"['kode', 'instagram', 'jangan', 'bagi']"
"Gunakan kode verifikasi ini untuk menetapkan PIN GO-PAY baru. Harap, jangan memberikan kode ini pada SIAPA PUN. Kode Anda: 778899",3,gunakan kode verifikasi ini untuk menetapkan pin go pay baru harap jangan memberikan kode ini pada siapa pun kode anda ,gunakan kode verifikasi ini untuk menetapkan pin go pay baru harap jangan memberikan kode ini pada siapa pun kode anda,gunakan kode verifikasi untuk menetapkan pin go pay baru harap jangan memberikan kode pada siapa kode,guna kode verifikasi untuk tetap pin go pay baru harap jangan beri kode pada siapa kode,"['guna', 'kode', 'verifikasi', 'untuk', 'tetap', 'pin', 'go', 'pay', 'baru', 'harap', 'jangan', 'beri', 'kode', 'pada', 'siapa', 'kode']"
"Mohon rahasiakan OTP Fita: 901234, jangan berikan kepada orang lain.",3,mohon rahasiakan otp fita  jangan berikan kepada orang lain,mohon rahasiakan otp fita jangan berikan kepada orang lain,mohon rahasiakan otp fita jangan berikan orang,mohon rahasia otp fita jangan ikan orang,"['mohon', 'rahasia', 'otp', 'fita', 'jangan', 'ikan', 'orang']"
"OTP Fita yang Anda miliki adalah: 345678, mohon tidak disebarkan ke siapa pun.",3,otp fita yang anda miliki adalah  mohon tidak disebarkan ke siapa pun,otp fita yang anda miliki adalah mohon tidak disebarkan ke siapa pun,otp fita anda miliki mohon disebarkan siapa,otp fita anda milik mohon sebar siapa,"['otp', 'fita', 'anda', 'milik', 'mohon', 'sebar', 'siapa']"
"PIN OTP Aktivasi: 678901. Harap jaga kerahasiaannya, jangan disampaikan kepada siapapun termasuk petugas bank.",3,pin otp aktivasi  harap jaga kerahasiaannya jangan disampaikan kepada siapapun termasuk petugas bank,pin otp aktivasi harap jaga kerahasiaannya jangan disampaikan kepada siapapun termasuk petugas bank,pin otp aktivasi harap jaga kerahasiaannya jangan disampaikan siapapun termasuk petugas bank,pin otp aktivasi harap jaga rahasia jangan sampai siapa masuk tugas bank,"['pin', 'otp', 'aktivasi', 'harap', 'jaga', 'rahasia', 'jangan', 'sampai', 'siapa', 'masuk', 'tugas', 'bank']"
Nomor OTP Anda: 456789. Aktif selama 45 menit.,3,nomor otp anda  aktif selama  menit,nomor otp anda aktif selama menit,nomor otp aktif selama menit,nomor otp aktif lama menit,"['nomor', 'otp', 'aktif', 'lama', 'menit']"
"Kode verifikasi transaksi digital di Tokopedia: 4321098. PENTING: Harap jangan dibagikan kepada siapapun atau pihak Tokopedia, untuk keamanan akun Anda.",3,kode verifikasi transaksi digital di tokopedia  penting harap jangan dibagikan kepada siapapun atau pihak tokopedia untuk keamanan akun anda,kode verifikasi transaksi digital di tokopedia penting harap jangan dibagikan kepada siapapun atau pihak tokopedia untuk keamanan akun anda,kode verifikasi transaksi digital tokopedia penting harap jangan dibagikan siapapun pihak tokopedia keamanan akun,kode verifikasi transaksi digital tokopedia penting harap jangan bagi siapa pihak tokopedia aman akun,"['kode', 'verifikasi', 'transaksi', 'digital', 'tokopedia', 'penting', 'harap', 'jangan', 'bagi', 'siapa', 'pihak', 'tokopedia', 'aman', 'akun']"
"Harap jangan berikan KODE RAHASIA ini kepada siapa pun, termasuk Bukalapak. Gunakan otentikasi: 678901",3,harap jangan berikan kode rahasia ini kepada siapa pun termasuk bukalapak gunakan otentikasi ,harap jangan berikan kode rahasia ini kepada siapa pun termasuk bukalapak gunakan otentikasi,harap jangan berikan kode rahasia kepada siapa termasuk bukalapak gunakan otentikasi,harap jangan ikan kode rahasia kepada siapa masuk bukalapak guna otentikasi,"['harap', 'jangan', 'ikan', 'kode', 'rahasia', 'kepada', 'siapa', 'masuk', 'bukalapak', 'guna', 'otentikasi']"
"IFG ID - OTP: 123456 PENTING, JANGAN SAMPAIKAN KODE INI KE PIHAK MANAPUN, termasuk IFG Life.",3,ifg id otp  penting jangan sampaikan kode ini ke pihak manapun termasuk ifg life,ifg id otp penting jangan sampaikan kode ini ke pihak manapun termasuk ifg life,ifg id otp penting jangan sampaikan kode ke pihak manapun termasuk ifg life,ifg id otp penting jangan sampai kode ke pihak mana masuk ifg life,"['ifg', 'id', 'otp', 'penting', 'jangan', 'sampai', 'kode', 'ke', 'pihak', 'mana', 'masuk', 'ifg', 'life']"
"Harap jangan berikan kode rahasia ini kepada siapa pun, termasuk Shopee. Waspada terhadap penipuan! Silakan ubah PIN ShopeePay, gunakan kode verifikasi (OTP) 678901",3,harap jangan berikan kode rahasia ini kepada siapa pun termasuk shopee waspada terhadap penipuan silakan ubah pin shopeepay gunakan kode verifikasi otp ,harap jangan berikan kode rahasia ini kepada siapa pun termasuk shopee waspada terhadap penipuan silakan ubah pin shopeepay gunakan kode verifikasi otp,harap jangan berikan kode rahasia kepada siapa termasuk shopee waspada penipuan silakan ubah pin shopeepay gunakan kode verifikasi otp,harap jangan ikan kode rahasia kepada siapa masuk shopee waspada tipu sila ubah pin shopeepay guna kode verifikasi otp,"['harap', 'jangan', 'ikan', 'kode', 'rahasia', 'kepada', 'siapa', 'masuk', 'shopee', 'waspada', 'tipu', 'sila', 'ubah', 'pin', 'shopeepay', 'guna', 'kode', 'verifikasi', 'otp']"
183618 KODE utk Verifikasi Akun Seller Anda. Berlaku 10 menit. JGN BAGIKAN KODE atau AKUN ANDA DPT DICURI,3, kode utk verifikasi akun seller anda berlaku  menit jgn bagikan kode atau akun anda dpt dicuri,kode untuk verifikasi akun seller anda berlaku menit jangan bagikan kode atau akun anda dapat dicuri,kode verifikasi akun seller berlaku menit jangan bagikan kode akun dapat dicuri,kode verifikasi akun seller laku menit jangan bagi kode akun dapat curi,"['kode', 'verifikasi', 'akun', 'seller', 'laku', 'menit', 'jangan', 'bagi', 'kode', 'akun', 'dapat', 'curi']"
<OTP SMS Banking Anda: 123456. Masa aktif OTP Anda adalah 15 menit. Terima Kasih.,3,otp sms banking anda  masa aktif otp anda adalah  menit terima kasih,otp sms banking anda masa aktif otp anda adalah menit terima kasih,otp sms banking masa aktif otp adalah menit terima kasih,otp sms banking masa aktif otp adalah menit terima kasih,"['otp', 'sms', 'banking', 'masa', 'aktif', 'otp', 'adalah', 'menit', 'terima', 'kasih']"
123456 adalah kode autentikasi Twitter Anda. Jangan balas pesan ini dengan kode Anda.,3, adalah kode autentikasi twitter anda jangan balas pesan ini dengan kode anda,adalah kode autentikasi twitter anda jangan balas pesan ini dengan kode anda,kode autentikasi twitter jangan balas pesan dengan kode,kode autentikasi twitter jangan balas pesan dengan kode,"['kode', 'autentikasi', 'twitter', 'jangan', 'balas', 'pesan', 'dengan', 'kode']"
tiket.com - Jangan beritahu kode OTP kamu pada siapa pun. Kode ini berlaku selama 10 menit. kode OTP : 7897,3,tiket com jangan beritahu kode otp kamu pada siapa pun kode ini berlaku selama  menit kode otp ,tiket com jangan beritahu kode otp kamu pada siapa pun kode ini berlaku selama menit kode otp,tiket com jangan beritahu kode otp kamu siapa kode berlaku selama menit kode otp,tiket com jangan beritahu kode otp kamu siapa kode laku lama menit kode otp,"['tiket', 'com', 'jangan', 'beritahu', 'kode', 'otp', 'kamu', 'siapa', 'kode', 'laku', 'lama', 'menit', 'kode', 'otp']"
"Tolong hindari memberikan KODE RAHASIA ini kepada siapapun, termasuk Bukalapak. Gunakan otentikasi: 890123",3,tolong hindari memberikan kode rahasia ini kepada siapapun termasuk bukalapak gunakan otentikasi ,tolong hindari memberikan kode rahasia ini kepada siapapun termasuk bukalapak gunakan otentikasi,hindari memberikan kode rahasia kepada siapapun termasuk bukalapak gunakan otentikasi,hindar beri kode rahasia kepada siapa masuk bukalapak guna otentikasi,"['hindar', 'beri', 'kode', 'rahasia', 'kepada', 'siapa', 'masuk', 'bukalapak', 'guna', 'otentikasi']"
Silakan gunakan Kode OTP 567890 untuk memverifikasi akun PeduliLindungi. Waktu validasi hanya 60 detik.,3,silakan gunakan kode otp  untuk memverifikasi akun pedulilindungi waktu validasi hanya  detik,silakan gunakan kode otp untuk memverifikasi akun pedulilindungi waktu validasi hanya detik,silakan gunakan kode otp memverifikasi akun pedulilindungi waktu validasi detik,sila guna kode otp verifikasi akun pedulilindungi waktu validasi detik,"['sila', 'guna', 'kode', 'otp', 'verifikasi', 'akun', 'pedulilindungi', 'waktu', 'validasi', 'detik']"
"Kode Verifikasi MOSELO : 621421 Kode ini hanya untuk kamu, jangan berikan ke siapapun. Pihak kami tidak pernah meminta kode ini.",3,kode verifikasi moselo  kode ini hanya untuk kamu jangan berikan ke siapapun pihak kami tidak pernah meminta kode ini,kode verifikasi moselo kode ini hanya untuk kamu jangan berikan ke siapapun pihak kami tidak pernah meminta kode ini,kode verifikasi moselo kode hanya kamu jangan berikan siapapun pihak tidak pernah meminta kode,kode verifikasi moselo kode hanya kamu jangan ikan siapa pihak tidak pernah minta kode,"['kode', 'verifikasi', 'moselo', 'kode', 'hanya', 'kamu', 'jangan', 'ikan', 'siapa', 'pihak', 'tidak', 'pernah', 'minta', 'kode']"
Ini adalah kode verifikasi untuk memasang PIN GO-PAY Anda yang baru. Waspada penipuan: JANGAN pernah berikan kode ini pada SIAPAPUN. Kode Anda 033366,3,ini adalah kode verifikasi untuk memasang pin go pay anda yang baru waspada penipuan jangan pernah berikan kode ini pada siapapun kode anda ,ini adalah kode verifikasi untuk memasang pin go pay anda yang baru waspada penipuan jangan pernah berikan kode ini pada siapapun kode anda,adalah kode verifikasi memasang pin go pay yang baru waspada penipuan jangan pernah berikan kode pada siapapun kode,adalah kode verifikasi pasang pin go pay yang baru waspada tipu jangan pernah ikan kode pada siapa kode,"['adalah', 'kode', 'verifikasi', 'pasang', 'pin', 'go', 'pay', 'yang', 'baru', 'waspada', 'tipu', 'jangan', 'pernah', 'ikan', 'kode', 'pada', 'siapa', 'kode']"
"Ini kode OTP untuk registrasi. Tolong hindari memberikannya kepada siapa pun, termasuk yang mengklaim dari Gojek, karena bisa digunakan untuk mengakses akunmu. OTP: 2345",3,ini kode otp untuk registrasi tolong hindari memberikannya kepada siapa pun termasuk yang mengklaim dari gojek karena bisa digunakan untuk mengakses akunmu otp ,ini kode otp untuk registrasi tolong hindari memberikannya kepada siapa pun termasuk yang mengklaim dari gojek karena bisa digunakan untuk mengakses akunmu otp,kode otp registrasi hindari memberikannya siapa termasuk mengklaim gojek bisa digunakan mengakses akunmu otp,kode otp registrasi hindar beri siapa masuk klaim gojek bisa guna akses akun otp,"['kode', 'otp', 'registrasi', 'hindar', 'beri', 'siapa', 'masuk', 'klaim', 'gojek', 'bisa', 'guna', 'akses', 'akun', 'otp']"
Gunakan OTP 069822 untuk memverifikasi akun PeduliLindungi Anda. OTP akan kadaluarsa dalam waktu 1 menit.,3,gunakan otp  untuk memverifikasi akun pedulilindungi anda otp akan kadaluarsa dalam waktu  menit,gunakan otp untuk memverifikasi akun pedulilindungi anda otp akan kadaluarsa dalam waktu menit,gunakan otp memverifikasi akun pedulilindungi otp kadaluarsa waktu menit,guna otp verifikasi akun pedulilindungi otp kadaluarsa waktu menit,"['guna', 'otp', 'verifikasi', 'akun', 'pedulilindungi', 'otp', 'kadaluarsa', 'waktu', 'menit']"
"[Easycash] Kode verifikasi: 789012, berlaku 5 menit. Jangan berikan kode ini kepada siapapun.",3,easycash kode verifikasi  berlaku  menit jangan berikan kode ini kepada siapapun,easycash kode verifikasi berlaku menit jangan berikan kode ini kepada siapapun,easycash kode verifikasi berlaku menit jangan berikan kode kepada siapapun,easycash kode verifikasi laku menit jangan ikan kode kepada siapa,"['easycash', 'kode', 'verifikasi', 'laku', 'menit', 'jangan', 'ikan', 'kode', 'kepada', 'siapa']"
Lazada: JANGAN BAGIKAN PIN ANDA KEPADA SIAPAPUN. Lazada tidak akan meminta PIN dari pelanggan. PIN untuk login: 211122 lzd,3,lazada jangan bagikan pin anda kepada siapapun lazada tidak akan meminta pin dari pelanggan pin untuk login  lzd,lazada jangan bagikan pin anda kepada siapapun lazada tidak akan meminta pin dari pelanggan pin untuk login lzd,lazada jangan bagikan pin kepada siapapun lazada akan meminta pin pelanggan pin login lzd,lazada jangan bagi pin kepada siapa lazada akan minta pin langgan pin login lzd,"['lazada', 'jangan', 'bagi', 'pin', 'kepada', 'siapa', 'lazada', 'akan', 'minta', 'pin', 'langgan', 'pin', 'login', 'lzd']"
JANGAN BERIKAN KODE RAHASIA ini kepada siapa pun TERMASUK PIHAK BUKALAPAK. Masukkan otentikasi: 95905,3,jangan berikan kode rahasia ini kepada siapa pun termasuk pihak bukalapak masukkan otentikasi ,jangan berikan kode rahasia ini kepada siapa pun termasuk pihak bukalapak masukkan otentikasi,jangan berikan kode rahasia kepada siapa termasuk pihak bukalapak masukkan otentikasi,jangan ikan kode rahasia kepada siapa masuk pihak bukalapak masuk otentikasi,"['jangan', 'ikan', 'kode', 'rahasia', 'kepada', 'siapa', 'masuk', 'pihak', 'bukalapak', 'masuk', 'otentikasi']"
Kode verifikasi melalui SMS: 1966.,3,kode verifikasi melalui sms ,kode verifikasi melalui sms,kode verifikasi melalui sms,kode verifikasi lalu sms,"['kode', 'verifikasi', 'lalu', 'sms']"
"Mohon tidak memberikan KODE OTP: 456789 yang berlaku 5 menit untuk perubahan data BCA, kepada siapapun termasuk yang mengaku dari BCA.",3,mohon tidak memberikan kode otp  yang berlaku  menit untuk perubahan data bca kepada siapapun termasuk yang mengaku dari bca,mohon tidak memberikan kode otp yang berlaku menit untuk perubahan data bca kepada siapapun termasuk yang mengaku dari bca,mohon memberikan kode otp berlaku menit perubahan data bca siapapun termasuk mengaku bca,mohon beri kode otp laku menit ubah data bca siapa masuk aku bca,"['mohon', 'beri', 'kode', 'otp', 'laku', 'menit', 'ubah', 'data', 'bca', 'siapa', 'masuk', 'aku', 'bca']"
"Harap jangan sampaikan OTP kepada siapa pun termasuk karyawan bank, untuk melindungi rekening Anda. OTP Livin: 5678",3,harap jangan sampaikan otp kepada siapa pun termasuk karyawan bank untuk melindungi rekening anda otp livin ,harap jangan sampaikan otp kepada siapa pun termasuk karyawan bank untuk melindungi rekening anda otp livin,harap jangan sampaikan otp siapa termasuk karyawan bank melindungi rekening otp livin,harap jangan sampai otp siapa masuk karyawan bank lindung rekening otp livin,"['harap', 'jangan', 'sampai', 'otp', 'siapa', 'masuk', 'karyawan', 'bank', 'lindung', 'rekening', 'otp', 'livin']"
"[Easycash] Kode verifikasi: 210987, berlaku selama 5 menit. Mohon tidak memberikan kode ini kepada siapa pun.",3,easycash kode verifikasi  berlaku selama  menit mohon tidak memberikan kode ini kepada siapa pun,easycash kode verifikasi berlaku selama menit mohon tidak memberikan kode ini kepada siapa pun,easycash kode verifikasi berlaku selama menit mohon memberikan kode kepada siapa,easycash kode verifikasi laku lama menit mohon beri kode kepada siapa,"['easycash', 'kode', 'verifikasi', 'laku', 'lama', 'menit', 'mohon', 'beri', 'kode', 'kepada', 'siapa']"
"Kode verifikasi untuk transaksi digital di Tokopedia: 9876543. PENTING: Mohon tidak menyebarkannya kepada siapapun atau ke Tokopedia, demi keamanan akun Anda.",3,kode verifikasi untuk transaksi digital di tokopedia  penting mohon tidak menyebarkannya kepada siapapun atau ke tokopedia demi keamanan akun anda,kode verifikasi untuk transaksi digital di tokopedia penting mohon tidak menyebarkannya kepada siapapun atau ke tokopedia demi keamanan akun anda,kode verifikasi transaksi digital tokopedia penting mohon menyebarkannya siapapun ke tokopedia keamanan akun,kode verifikasi transaksi digital tokopedia penting mohon sebar siapa ke tokopedia aman akun,"['kode', 'verifikasi', 'transaksi', 'digital', 'tokopedia', 'penting', 'mohon', 'sebar', 'siapa', 'ke', 'tokopedia', 'aman', 'akun']"
"Mohon tidak berikan kode rahasia ini kepada siapa pun, termasuk Shopee. Waspada penipuan! Silakan ubah PIN ShopeePay, masukkan kode verifikasi (OTP) 901234",3,mohon tidak berikan kode rahasia ini kepada siapa pun termasuk shopee waspada penipuan silakan ubah pin shopeepay masukkan kode verifikasi otp ,mohon tidak berikan kode rahasia ini kepada siapa pun termasuk shopee waspada penipuan silakan ubah pin shopeepay masukkan kode verifikasi otp,mohon berikan kode rahasia kepada siapa termasuk shopee waspada penipuan silakan ubah pin shopeepay masukkan kode verifikasi otp,mohon ikan kode rahasia kepada siapa masuk shopee waspada tipu sila ubah pin shopeepay masuk kode verifikasi otp,"['mohon', 'ikan', 'kode', 'rahasia', 'kepada', 'siapa', 'masuk', 'shopee', 'waspada', 'tipu', 'sila', 'ubah', 'pin', 'shopeepay', 'masuk', 'kode', 'verifikasi', 'otp']"
Kode verifikasi untuk akun Google Anda adalah G-291695,3,kode verifikasi untuk akun google anda adalah g ,kode verifikasi untuk akun google anda adalah g,kode verifikasi akun google adalah g,kode verifikasi akun google adalah g,"['kode', 'verifikasi', 'akun', 'google', 'adalah', 'g']"
"Harap jaga kerahasiaan OTP Fita: 567890, jangan sampaikan kepada siapa pun.",3,harap jaga kerahasiaan otp fita  jangan sampaikan kepada siapa pun,harap jaga kerahasiaan otp fita jangan sampaikan kepada siapa pun,harap jaga kerahasiaan otp fita jangan sampaikan siapa,harap jaga rahasia otp fita jangan sampai siapa,"['harap', 'jaga', 'rahasia', 'otp', 'fita', 'jangan', 'sampai', 'siapa']"
"<#> Kode Verifikasi OVO: 9371 JANGAN BERIKAN KODE RAHASIA INI KEPADA SIAPA PUN, TERMASUK PIHAK YANG MENGAKU DARI OVO Hubungi 1500696 untuk bantuan",3,kode verifikasi ovo  jangan berikan kode rahasia ini kepada siapa pun termasuk pihak yang mengaku dari ovo hubungi  untuk bantuan,kode verifikasi ovo jangan berikan kode rahasia ini kepada siapa pun termasuk pihak yang mengaku dari ovo hubungi untuk bantuan,kode verifikasi ovo jangan berikan kode rahasia kepada siapa termasuk pihak mengaku ovo hubungi bantuan,kode verifikasi ovo jangan ikan kode rahasia kepada siapa masuk pihak aku ovo hubung bantu,"['kode', 'verifikasi', 'ovo', 'jangan', 'ikan', 'kode', 'rahasia', 'kepada', 'siapa', 'masuk', 'pihak', 'aku', 'ovo', 'hubung', 'bantu']"
Kode verifikasi SMS Anda: 9166.,3,kode verifikasi sms anda ,kode verifikasi sms anda,kode verifikasi sms,kode verifikasi sms,"['kode', 'verifikasi', 'sms']"
"PIN OTP yang terlupakan adalah 234567. Mohon selalu rahasiakan PIN OTP Anda. Jangan diinformasikan kepada siapapun, termasuk petugas bank.",3,pin otp yang terlupakan adalah  mohon selalu rahasiakan pin otp anda jangan diinformasikan kepada siapapun termasuk petugas bank,pin otp yang terlupakan adalah mohon selalu rahasiakan pin otp anda jangan diinformasikan kepada siapapun termasuk petugas bank,pin otp terlupakan mohon selalu rahasiakan pin otp jangan diinformasikan siapapun termasuk petugas bank,pin otp lupa mohon selalu rahasia pin otp jangan informasi siapa masuk tugas bank,"['pin', 'otp', 'lupa', 'mohon', 'selalu', 'rahasia', 'pin', 'otp', 'jangan', 'informasi', 'siapa', 'masuk', 'tugas', 'bank']"
"Tokopedia – 1234567 adalah kode verifikasi untuk transaksi digital. PENTING: Mohon tidak menyebarkan kode ke orang lain atau pihak Tokopedia, demi keamanan akun.",3,tokopedia  adalah kode verifikasi untuk transaksi digital penting mohon tidak menyebarkan kode ke orang lain atau pihak tokopedia demi keamanan akun,tokopedia adalah kode verifikasi untuk transaksi digital penting mohon tidak menyebarkan kode ke orang lain atau pihak tokopedia demi keamanan akun,tokopedia kode verifikasi transaksi digital penting mohon menyebarkan kode orang atau pihak tokopedia keamanan akun,tokopedia kode verifikasi transaksi digital penting mohon sebar kode orang atau pihak tokopedia aman akun,"['tokopedia', 'kode', 'verifikasi', 'transaksi', 'digital', 'penting', 'mohon', 'sebar', 'kode', 'orang', 'atau', 'pihak', 'tokopedia', 'aman', 'akun']"
Kode verifikasi untuk Akun Seller: 345678. Masa berlaku 10 menit. Jangan bagikan atau akun Anda bisa terancam.,3,kode verifikasi untuk akun seller  masa berlaku  menit jangan bagikan atau akun anda bisa terancam,kode verifikasi untuk akun seller masa berlaku menit jangan bagikan atau akun anda bisa terancam,kode verifikasi akun seller masa berlaku menit jangan bagikan akun bisa terancam,kode verifikasi akun seller masa laku menit jangan bagi akun bisa ancam,"['kode', 'verifikasi', 'akun', 'seller', 'masa', 'laku', 'menit', 'jangan', 'bagi', 'akun', 'bisa', 'ancam']"
OTP Fita Anda adalah 738987 Mohon jangan berikan kode ini ke siapapun.,3,otp fita anda adalah  mohon jangan berikan kode ini ke siapapun,otp fita anda adalah mohon jangan berikan kode ini ke siapapun,otp fita adalah mohon jangan berikan kode ke siapapun,otp fita adalah mohon jangan ikan kode ke siapa,"['otp', 'fita', 'adalah', 'mohon', 'jangan', 'ikan', 'kode', 'ke', 'siapa']"
123456 adalah kode verifikasi untuk Twitter Anda. Mohon jangan membalas pesan ini dengan kode Anda.,3, adalah kode verifikasi untuk twitter anda mohon jangan membalas pesan ini dengan kode anda,adalah kode verifikasi untuk twitter anda mohon jangan membalas pesan ini dengan kode anda,kode verifikasi twitter mohon jangan membalas pesan dengan kode,kode verifikasi twitter mohon jangan balas pesan dengan kode,"['kode', 'verifikasi', 'twitter', 'mohon', 'jangan', 'balas', 'pesan', 'dengan', 'kode']"
"Mohon jangan berikan OTP kepada siapapun, termasuk staf bank, untuk keamanan rekening Anda. OTP Livin: 2345",3,mohon jangan berikan otp kepada siapapun termasuk staf bank untuk keamanan rekening anda otp livin ,mohon jangan berikan otp kepada siapapun termasuk staf bank untuk keamanan rekening anda otp livin,mohon jangan berikan otp siapapun termasuk staf bank keamanan rekening otp livin,mohon jangan ikan otp siapa masuk staf bank aman rekening otp livin,"['mohon', 'jangan', 'ikan', 'otp', 'siapa', 'masuk', 'staf', 'bank', 'aman', 'rekening', 'otp', 'livin']"
"MOSELO Kode Verifikasi: 901234 Hanya untuk Anda, harap jangan sebarkan. Kami tidak meminta kode ini.",3,moselo kode verifikasi  hanya untuk anda harap jangan sebarkan kami tidak meminta kode ini,moselo kode verifikasi hanya untuk anda harap jangan sebarkan kami tidak meminta kode ini,moselo kode verifikasi untuk harap jangan sebarkan tidak meminta kode,moselo kode verifikasi untuk harap jangan sebar tidak minta kode,"['moselo', 'kode', 'verifikasi', 'untuk', 'harap', 'jangan', 'sebar', 'tidak', 'minta', 'kode']"
G-569219 adalah kode verifikasi Google Anda,3,g  adalah kode verifikasi google anda,g adalah kode verifikasi google anda,g kode verifikasi google,g kode verifikasi google,"['g', 'kode', 'verifikasi', 'google']"
